,subreddit,author,domain,title,num_comments,score,timestamp
0,worldnews,Clubpenguin696969,washingtonexaminer.com,North Korean media claims Kim Jong Un is alive and made first public appearance since health rumors,0,1,1588382649
1,worldnews,Clubpenguin696969,washingtonexaminer.com,North Korean media claims Kim Jong Un is alive and made first public appearance since health rumors,0,1,1588382218
2,worldnews,Clubpenguin696969,washingtonexaminer.com,North Korean media claims Kim Jong Un is alive and made first public appearance since health rumors,0,1,1588382197
3,worldnews,Clubpenguin696969,washingtonexaminer.com,North Korean media claims Kim Jong Un is alive and made first public appearance since health rumors,0,1,1588382167
4,worldnews,Clubpenguin696969,washingtonexaminer.com,North Korean media claims Kim Jong Un is alive and made first public appearance since health rumors,0,1,1588382159
5,worldnews,Clubpenguin696969,washingtonexaminer.com,North Korean media claims Kim Jong Un is alive and made first public appearance since health rumors,0,1,1588382139
6,worldnews,Clubpenguin696969,washingtonexaminer.com,North Korean media claims Kim Jong Un is alive and made first public appearance since health rumors,0,1,1588382134
7,worldnews,Clubpenguin696969,washingtonexaminer.com,North Korean media claims Kim Jong Un is alive and made first public appearance since health rumors,0,1,1588382102
8,worldnews,Clubpenguin696969,washingtonexaminer.com,North Korean media claims Kim Jong Un is alive and made first public appearance since health rumors,0,1,1588382082
9,worldnews,Gonad-Brained-Gimp,bbc.co.uk,Why biggest challenge is yet to come on testing,0,1,1588381741
10,worldnews,Netship01,reuters.com,"After rumours about health, North Korea state media report Kim Jong Un appearance",0,1,1588381239
11,worldnews,Netship01,reuters.com,"After rumours about health, North Korea state media report Kim Jong Un appearance",0,1,1588381236
12,worldnews,Netship01,reuters.com,"After rumours about health, North Korea state media report Kim Jong Un appearance",0,1,1588380860
13,worldnews,Netship01,reuters.com,"After rumours about health, North Korea state media report Kim Jong Un appearance",0,1,1588380611
14,worldnews,ibelieveinthanos,reuters.com,"After rumours about health, North Korea state media report Kim Jong Un appearance",0,1,1588380547
15,worldnews,Netship01,reuters.com,"After rumours about health, North Korea state media report Kim Jong Un appearance",0,1,1588380528
16,worldnews,Netship01,nytimes.com,"Kim Jong-un Resurfaces, State Media Says, After Weeks of Health Rumors",0,1,1588380467
17,worldnews,ibelieveinthanos,reuters.com,"After rumours about health, North Korea state media report Kim Jong Un appearance",0,1,1588380353
18,worldnews,ibelieveinthanos,reuters.com,"After rumours about health, North Korea state media report Kim Jong Un appearance",0,1,1588380280
19,worldnews,ibelieveinthanos,reuters.com,"After rumours about health, North Korea state media report Kim Jong Un appearance",0,1,1588380239
20,worldnews,ibelieveinthanos,reuters.com,"After rumours about health, North Korea state media report Kim Jong Un appearance",0,1,1588380225
21,worldnews,ibelieveinthanos,reuters.com,"After rumours about health, North Korea state media report Kim Jong Un appearance",0,1,1588380219
22,worldnews,montak22,coronavirusin.world,Protesters Crowd Huntington Beach Day After Newsom Orders Closure of All O.C. Beaches (Video),0,1,1588379849
23,worldnews,dcismia,reuters.com,"Venezuela sets new price controls, with eggs costing more than a month's wages",0,1,1588379674
24,worldnews,D2theCCNP,reuters.com,"Venezuela sets new price controls, with eggs costing more than a month's wages",0,1,1588379422
25,worldnews,Amjad_Abed1980,youtube.com,In our country it is called the disobedience of the Prophet,0,1,1588379332
26,worldnews,Amjad_Abed1980,youtube.com,In our country it is called the disobedience of the Prophet,0,1,1588379323
27,worldnews,EvangelionWeeb,nytimes.com,"Kim Jong-un Resurfaces, State Media Says, After Weeks of Health Rumors",0,1,1588379098
28,worldnews,D2theCCNP,reuters.com,"Venezuela sets new price controls, with eggs costing more than a month's wages",0,1,1588378693
29,worldnews,pushkarprabhat,in.reuters.com,"Poor stay poor, rich get richer? Virus aid weighs on EU market competition",0,1,1588378674
30,worldnews,pushkarprabhat,in.reuters.com,"Asia gold demand steady in Singapore, little action elsewhere",0,1,1588378645
31,worldnews,pushkarprabhat,in.reuters.com,Exclusive: Britain hires Morgan Stanley to advise on aviation rescue plan - sources,0,1,1588378615
32,worldnews,cottonreel,independent.co.uk,"Kim Jong-un appears in public for first time in 20 days, North Korean state media reports",0,1,1588378593
33,worldnews,cottonreel,independent.co.uk,"Kim Jong-un appears in public for first time in 20 days, North Korean state media reports",0,1,1588378538
34,worldnews,CaptainWaffleIron,nytimes.com,"Kim Jong-un Resurfaces, State Media Says, After Weeks of Health Rumors",0,1,1588378532
35,worldnews,CaptainWaffleIron,nytimes.com,"Kim Jong-un Resurfaces, State Media Says, After Weeks of Health Rumors",0,1,1588378530
36,worldnews,CaptainWaffleIron,nytimes.com,"Kim Jong-un Resurfaces, State Media Says, After Weeks of Health Rumors",0,1,1588378499
37,worldnews,cottonreel,independent.co.uk,"Kim Jong-un appears in public for first time in 20 days, North Korean state media reports",0,1,1588378476
38,worldnews,pushkarprabhat,in.reuters.com,Algeria leader vows to develop new resources beyond energy to ease economic crisis,0,1,1588378419
39,worldnews,pushkarprabhat,in.reuters.com,KCNA reports North Korea leader Kim Jong Un resuming public activity,0,1,1588378284
40,worldnews,pushkarprabhat,in.reuters.com,"Countries must ease lockdowns slowly, be ready for virus to jump back: WHO",0,1,1588378227
41,worldnews,pushkarprabhat,in.reuters.com,"Boeing raises $25 billion in blowout debt sale, eschews government aid",0,1,1588378141
42,worldnews,pushkarprabhat,in.reuters.com,U.S. manufacturing activity plunges to 11-year low as orders sink,0,1,1588378107
43,worldnews,winterfellhari,independent.co.uk,"North Korea’s Kim Jong Un makes a public appearance for the first time in weeks, state news agency KCNA says.",0,1,1588378097
44,worldnews,pushkarprabhat,in.reuters.com,"Jetmaker Embraer focuses on future after Boeing divorce ""pain""",0,1,1588378085
45,worldnews,30ustice4,washingtonpost.com,Justice Dept. scrutinizes White House-connected doctor linked to disputed coronavirus treatment,0,1,1588378077
46,worldnews,pushkarprabhat,in.reuters.com,"Exxon, Chevron slam brakes on shale as oil demand tumbles",0,1,1588378044
47,worldnews,Defiant-Month,theguardian.com,The US opioid crisis has wrecked Mexico's heroin trade as Americans switch to synthetic opioids like fentanyl,0,1,1588377245
48,worldnews,BigBulkemails,edition.cnn.com,North Korean state media reports Kim Jong Un made first public appearance in weeks,12,1,1588376327
49,worldnews,Radiant-Falcon,theguardian.com,11-year old boy shot in east London,8,1,1588376316
50,worldnews,BigBulkemails,youtube.com,North Korea says Kim Jong Un made public appearance,0,1,1588376253
51,worldnews,montak22,coronavirusin.world,"To keep away from scores downgrade, India could cap virus reduction at $60bn",0,1,1588376228
52,worldnews,montak22,coronavirusin.world,Contagion threat stays excessive as Italy will get able to reopen,0,1,1588376227
53,worldnews,montak22,coronavirusin.world,White House blocks Anthony Fauci from testifying earlier than Congress,0,1,1588376226
54,worldnews,montak22,coronavirusin.world,"Coronavirus surge in Brazil brings coffin scarcity, morgue chaos",0,1,1588376225
55,worldnews,montak22,coronavirusin.world,James Wan to Produce Time Travel Thriller ‘Hunting Season’ From ‘John Wick’ Writer Derek Kolstad,0,1,1588376224
56,worldnews,Khilaaf,youtube.com,We shouldn't be worrying about him he is in a safe sandwich,2,1,1588376153
57,worldnews,thecreepyfriend,vox.com,North Korea’s Kim Jong Un is alive — and at a fertilizer factory,16,1,1588375968
58,worldnews,AmericanBornChink,cnn.com,North Korean state media reports Kim Jong Un made first public appearance in weeks,0,1,1588375964
59,worldnews,bilaledz53,twitter.com,White House blocks Fauci from testifying next week,0,1,1588375928
60,worldnews,AdrienSergent,nbcnews.com,Emails show Trump admin had 'no way to link' separated migrant children to parents,0,1,1588375204
61,worldnews,pushkarprabhat,in.reuters.com,Exclusive: India set to cap stimulus package at $60 billion to protect credit rating - sources,0,1,1588375109
62,worldnews,Khilaaf,bbc.co.uk,He too was high af,0,1,1588374962
63,worldnews,princey12,foxnews.com,16th-century African skeletons discovered in Mexico City shed new light on early colonial slave trade,1,1,1588374890
64,worldnews,jamfun3,bloomberg.com,North Korea’s Kim Resurfaces With Visit to Fertilizer Factory,8,1,1588374578
65,worldnews,mostaksaif,theguardian.com,Global markets recoil as Trump threatens US-China trade war,2,1,1588374459
66,worldnews,TheWrittenLore,edition.cnn.com,"China can shut off the Philippines' power grid at any time, leaked report warns",1,1,1588374368
67,worldnews,Radiant-Falcon,reuters.com,Alberta launches Canada's first contact tracing app as economy slowly reopens,1,1,1588374236
68,worldnews,AngelofDeath2020,edition.cnn.com,"Flamingos flock to a locked-down Mumbai: The humans may be in lockdown in India, but tens of thousands of flamingos are making the most of the peace and quiet.",2,1,1588374159
69,worldnews,apple_orange_banana,nytimes.com,"Kim Jong-un Resurfaces, State Media Says, Ending Weeks of Health Rumors",9,1,1588373986
70,worldnews,SantGir920,nationalpost.com,Trump says tariffs on China 'certainly an option',8,1,1588373956
71,worldnews,WoolfordStudiosLtd,youtube.com,Jalisco Fiasco Daily 01-05-2020,0,1,1588373839
72,worldnews,wrapityup,theguardian.com,Germany to set out rules for religious services including singing ban — Angela Merkel to meet with state leaders over safely conducting services during pandemic,2,1,1588373806
73,worldnews,Sarbat_Khalsa,independent.co.uk,Cat meat traders in Vietnam ‘stealing beloved family pets’ during coronavirus,3,1,1588373542
74,worldnews,craiger_123,cnn.com,White House blocks Fauci from testifying next week,152,1,1588373170
75,worldnews,Marcmin,time.com,North Korea’s Kim Jong Un Reportedly Appears in Public Amid Rampant Health Rumors,25,1,1588373046
76,worldnews,xenocracyn,uk.reuters.com,Majority of Britons believe climate-change could end human race - poll,0,1,1588373046
77,worldnews,DrOfGarbageTV,newsweek.com,Kim Jong Un appears in public,6,1,1588372100
78,worldnews,xenocracyn,theguardian.com,"'Russian spy' whale has defected to Norway, locals claim",0,1,1588371996
79,worldnews,Aerobics111,washingtonexaminer.com,Germany refuses to join Trump in seeking to punish China for coronavirus pandemic,27,1,1588371979
80,worldnews,Raekooz,reuters.com,"Poland releases 800,000 tonnes of oil reserves after Russian imports halted",0,1,1588371865
81,worldnews,joilyboily,bbc.co.uk,Kim Jong-un appears in public - state media,10,1,1588371814
82,worldnews,muchdanwow,news.sky.com,North Korea's Kim Jong Un 'seen in public' for first time since rumours of ill health,6,1,1588371764
83,worldnews,Io45s785a2,newsweek.com,Russian state television pushes conspiracy theory Bill Gates is behind coronavirus pandemic,19,1,1588371753
84,worldnews,wrapityup,theguardian.com,Five already dead by time UK reported first coronavirus death — Official data shows first fatality happened three days before government announcement,3,1,1588371624
85,worldnews,wrapityup,theguardian.com,British 72-year-old is oldest person to row solo across Atlantic — Graham Walters nearly missed out when he was blown off course six miles from Antigua,0,1,1588371527
86,worldnews,philipna,reuters.com,KCNA reports North Korea leader Kim Jong Un resuming public activity,15,1,1588371328
87,worldnews,PontusMeister,thesun.co.uk,Kim Jong-un reportedly made first public appearance in 20 days after rumours he was dead or incapacitated,3,1,1588371273
88,worldnews,1wakeupcall,youtube.com,Funeral Directors SPEAK TRUTH for CV19 Deaths Reporting,0,1,1588370878
89,worldnews,xenocracyn,theguardian.com,"'Russian spy' whale has defected to Norway, locals claim",0,1,1588370835
90,worldnews,TouchingEwe,bbc.co.uk,Duchess of Sussex: Mail on Sunday wins first round in Meghan privacy case,0,1,1588370562
91,worldnews,wibblymat,bbc.co.uk,Kim Jong-un appears in public - state media,59,1,1588370200
92,worldnews,HeiligerJacobus,cnn.com,Swedish city to dump tonne of chicken manure in park to deter visitors,3,1,1588370114
93,worldnews,PrincipledInelegance,washingtonpost.com,"North Korean leader Kim Jong Un makes public appearance, state media says",15,1,1588370064
94,worldnews,DoremusJessup,france24.com,"Protests broke out across opposition-held parts of northwest Syria Friday against an al-Qaeda-linked jihadist group after it opened a trade crossing into regime territory. In particular, the demonstrators ""voiced their refusal to open any crossing with regime forces in the area""",0,1,1588370063
95,worldnews,zdzdbets,thesun.co.uk,Ryanair don't expect flights to return to normal for more than two years,2,1,1588370037
96,worldnews,mostaksaif,vox.com,Pressure mounts on Trump to “drop the hammer” on China,1,1,1588370027
97,worldnews,MrKlowb,washingtonpost.com,White House blocks Fauci from testifying before House panel,2,1,1588369992
98,worldnews,DoremusJessup,france24.com,"Hundreds of Lebanese rallied Friday outside the central bank in Beirut and elsewhere in the country, a day after the prime minister said he would seek a rescue plan from the International Monetary Fund to deal with a spiraling economic and financial crisis",0,1,1588369838
99,worldnews,DoremusJessup,france24.com,"Chilean police on Friday arrested dozens of people, including press photographers, when they broke up a May Day demonstration in the capital Santiago. Demonstrators had gathered in the city's Plaza Italia in defiance of a government prohibition on public gatherings of more than 50 people",0,1,1588369696
100,worldnews,felixmontoya92,washingtonpost.com,"North Korean media says leader Kim Jong Un makes first public appearance in weeks, ending rumors about health",10,1,1588369582
101,worldnews,Marcmin,time.com,‘Canadians Need More Than Thoughts and Prayers.’ Trudeau Bans Assault-style Weapons After Nova Scotia Shooting Rampage,89,1,1588369455
102,worldnews,IMissFreedom,cnn.com,"Ryanair will cut 3,000 jobs and keep 99% of flights grounded through June",6,1,1588369452
103,worldnews,lotsofspaghetti100,bbc.co.uk,Kim Jong-un appears in public - state media,5,1,1588369362
104,worldnews,Formulaica,reuters.com,"Poland releases 800,000 tonnes of oil reserves after Russian imports halted",1,1,1588369319
105,worldnews,liverpooltarheels,bloomberg.com,"North Korean leader Kim Jong Un attended the opening of a fertilizer factory on May Day, according to state media",9,1,1588369295
106,worldnews,masshole2303,bbc.co.uk,Kim Jong-un appears in public - state media - BBC News,13,1,1588369255
107,worldnews,Radiant-Falcon,reuters.com,KCNA reports North Korea leader Kim Jong Un resuming public activity,2,1,1588369185
108,worldnews,idarknight,bbc.co.uk,Kim Jong-un appears in public - state media,0,1,1588369125
109,worldnews,curiousgeorgeasks,bbc.co.uk,BBC News: Kim Jong-un appears in public - state media,5,1,1588369115
110,worldnews,montak22,coronavirusin.world,"‘John Wick 4’ Pushed to Summer 2022, Chris Rock’s ‘Saw’ Movie ‘Spiral’ Moves to 2021",0,1,1588369042
111,worldnews,montak22,coronavirusin.world,Trump: US drug approval company authorises use of remdesivir,0,1,1588369041
112,worldnews,montak22,coronavirusin.world,Musk Twitter rant tanks Tesla inventory,0,1,1588369040
113,worldnews,montak22,coronavirusin.world,Infowars’ Alex Jones Declares He ‘Would Eat’ His Neighbors (Video),0,1,1588369040
114,worldnews,montak22,coronavirusin.world,"Seth Rogen, Evan Goldberg Developing Adult Animated Comedy ‘Bubble’ Based on Podcast at Sony",0,1,1588369039
115,worldnews,KalelQuaff,dutchnews.nl,‘Death to gays’ preacher Steven Anderson banned from Netherlands,0,1,1588368689
116,worldnews,Radiant-Falcon,theguardian.com,Trump press secretary attacks China and WHO at first White House briefing,0,1,1588368574
117,worldnews,hildebrand_rarity,independent.co.uk,Cat meat traders in Vietnam 'stealing beloved family pets' as business thrives during coronavirus,4,1,1588368537
118,worldnews,wrapityup,theguardian.com,"Japanese aquarium urges public to video-chat eels who are forgetting humans exist — Sensitive creatures are starting to hide when keepers walk past, as a result of the lack of visitors",15,1,1588368491
119,worldnews,Tommy__Douglas,twitter.com,BREAKING: North Korean leader Kim Jong Un makes first public appearance in 20 days after rumors of his death,0,1,1588368205
120,worldnews,HugeDetective0,thesun.co.uk,Kim Jong-un ‘makes first public appearance in 20 days’ after rumours he was dead or incapacitated,9,1,1588368186
121,worldnews,chrisdh79,independent.co.uk,Canada bans assault weapons following worst-ever mass shooting,597,1,1588367519
122,worldnews,Radiant-Falcon,nytimes.com,"Bolsonaro Fights for Survival, Turning to Empowered Military Elders",3,1,1588367104
123,worldnews,Radiant-Falcon,newsweek.com,Coronavirus infections in Russia surge as Putin says phased lockdown exit could begin in two weeks,0,1,1588366885
124,worldnews,wrapityup,theguardian.com,Queensland man given seven life sentences for three weeks of violent attacks on woman — Nicholas John Crilley raped and burned the then 22-year-old during 23 days of drug-induced violence in 2017,2,1,1588366848
125,worldnews,BelleAriel,newsweek.com,Coronavirus infections in Russia surge as Putin says phased lockdown exit could begin in two weeks,3,1,1588366738
126,worldnews,Duc4Reddit,theguardian.com,Coronavirus live news: WHO asserts virus 'is natural in origin' | World news,37,1,1588366723
127,worldnews,wrapityup,theguardian.com,Indian students trapped in UK by coronavirus 'actually starving',2,1,1588366707
128,worldnews,discocrisco,reuters.com,"Bolivian Parliament approves law calling for elections in 90 days, defying interim government",3,1,1588366662
129,worldnews,WoolfordStudiosLtd,youtube.com,LHG Daily 01-05-2020,0,1,1588366643
130,worldnews,WoolfordStudiosLtd,youtube.com,SwipeStrike Daily 01-05-2020,0,1,1588366643
131,worldnews,WoolfordStudiosLtd,youtube.com,Head Home Daily 01-05-2020,0,1,1588366642
132,worldnews,gamer23909,reuters.com,Robots on hand to greet Japanese coronavirus patients in hotels,1,1,1588366545
133,worldnews,Kyuu_Ichi_Roku,reuters.com,"Amazon, Target, Instacart workers protest on May Day",6,1,1588365719
134,worldnews,craiger_123,cnn.com,Tesla stock tanks after Musk tweets price is 'too high',5,1,1588365712
135,worldnews,paone22,nytimes.com,"Under Modi, India’s Press Is Not So Free Anymore",15,1,1588365506
136,worldnews,Radiant-Falcon,nbcnews.com,"Canada bans assault-style weapons, Trudeau says people deserve more than ‘thoughts and prayers’",8,1,1588365229
137,worldnews,Frocharocha,reuters.com,Brazil's São Paulo governor makes masks mandatory as COVID-19 spreads,1,1,1588364644
138,worldnews,howtochangemywife,news.sky.com,"India evacuates 800,000 people as country braces for Tropical Cyclone Fani",0,1,1588364197
139,worldnews,KnownStuff,theguardian.com,WhatsApp: Israeli firm 'deeply involved' in hacking our users,2,1,1588363152
140,worldnews,WoolfordStudiosLtd,youtube.com,Sweets Skyscraper Daily 01-05-2020,0,1,1588363045
141,worldnews,WoolfordStudiosLtd,youtube.com,Square Chase Daily 01-05-2020,0,1,1588363045
142,worldnews,AdrienSergent,theguardian.com,"'Russian spy' whale has defected to Norway, locals claim",0,1,1588362248
143,worldnews,BlueLight03,newsweek.com,"Wuhan ranks a top domestic travel spot to visit after the coronavirus ends, according to a Chinese tourism research center",16,1,1588360792
144,worldnews,Fuzier,nytimes.com,"As Workers Fall Ill, U.S. Presses Mexico to Keep American-Owned Plants Open: Multinational corporations with factories in Mexico have remained open, even after coronavirus outbreaks hit their facilities.",4,1,1588360535
145,worldnews,dirtyviking1337,metro.co.uk,Travelling circuses to be banned from using wild animals in England,2,1,1588360513
146,worldnews,montak22,coronavirusin.world,Reopening South Africa’s economic system could also be particularly painful,0,1,1588360402
147,worldnews,montak22,coronavirusin.world,Bolivia’s parliament passes regulation calling for elections in 90 days,0,1,1588360401
148,worldnews,montak22,coronavirusin.world,Custody battles tackle new issues amid coronavirus disaster,0,1,1588360400
149,worldnews,montak22,coronavirusin.world,"Michael Caputo, HHS Spokesperson, Called Women ‘Dog Face,’ ‘Nutty Hag’ in Deleted Tweets",0,1,1588360399
150,worldnews,montak22,coronavirusin.world,Can’t Unlock Your iPhone With Face Mask On? Apple Is Testing a Fix,0,1,1588360398
151,worldnews,montak22,coronavirusin.world,Class motion: US faculty college students sue for tuition refunds,0,1,1588360398
152,worldnews,zdzdbets,bloomberg.com,Fear of Chinese and U.S. Buyers Forces Europe Onto Defensive,2,1,1588360176
153,worldnews,xenocracyn,metro.co.uk,Travelling circuses to be banned from using wild animals in England,2,1,1588359958
154,worldnews,Fuzier,nytimes.com,"He Indicted Netanyahu, but Sees No Reason to Bar Him From Office: Israel's Supreme Court is to hear arguments on petitions to disqualify the prime minister, who faces trial on corruption charges, and against a coalition deal.",3,1,1588359764
155,worldnews,pmcd_com,theguardian.com,"'Russian spy' whale has defected to Norway, locals claim",0,1,1588359647
156,worldnews,JerryWizard,reuters.com,Business booms for 'yellow' firms backing Hong Kong protest movement,1,1,1588359535
157,worldnews,WoolfordStudiosLtd,youtube.com,Deep Dive Daily 01-05-2020,0,1,1588359443
158,worldnews,IntnsRed,washingtonpost.com,"Israeli bank fined nearly $1 billion in U.S. tax evasion, money laundering cases",2,1,1588359407
159,worldnews,ajacied34,google.com,North Korean Defector Says Kim Jong Un is Almost Certainly Dead,2,1,1588359370
160,worldnews,Fuzier,nytimes.com,Germany Hardens Ban on Hezbollah: The United States and Israel welcomed Berlin’s move to effectively outlaw all activity by the militant group and called on the rest of Europe to follow suit.,7,1,1588359339
161,worldnews,SeleniumF0rest,france24.com,Two die from measles in Switzerland: A 30-year-old previously unvaccinated man and a 70-year-old man whose immune system had been weakened by cancer,0,1,1588359289
162,worldnews,Fuzier,nytimes.com,"Top E.U. Diplomat Says Disinformation Report Was Not Watered Down for China: Josep Borrell said that China expressed its concerns over the report, but he would not explain how. European lawmakers appeared skeptical.",2,1,1588359103
163,worldnews,keysersozemccandless,news.sky.com,"Ireland announces 5-stage coronavirus exit plan, targeting an end of the plan on August 10th",1,1,1588358870
164,worldnews,mostaksaif,vox.com,Germany is reopening. Cautiously.,1,1,1588358636
165,worldnews,Ford456fgfd,time.com,China Warns Australia It Could Face Boycotts Over Call for an Independent Inquiry Into Coronavirus,0,1,1588358614
166,worldnews,muktadas,twitter.com,Super men,2,1,1588358419
167,worldnews,howtochangemywife,japantimes.co.jp,Nearly 80% in Japan support having women on throne and 82% feel affection for new emperor | The Japan Times,0,1,1588358347
168,worldnews,thejsantiago,cnn.com,"UK Accomplishes Its Target of 100,000 Coronavirus Tests a Day",2,1,1588358251
169,worldnews,SeleniumF0rest,nbcnews.com,Emails show Trump admin had 'no way to link' separated migrant children to parents,0,1,1588357873
170,worldnews,catherine2255,bbc.co.uk,Bob Hoskins dies of pneumonia aged 71,3,1,1588357473
171,worldnews,TheApexPodcast,youtube.com,Centivax: Live COVID-19 Research Update,2,1,1588357468
172,worldnews,Infjuk,theguardian.com,"UK Foreign Office Obstructed Search For Truth, Say Harry Dunn Lawyers.",1,1,1588357277
173,worldnews,angjiankai02,foxnews.com,Hiker celebrating end of coronavirus lockdown falls to her death while posing for photo,12,1,1588356883
174,worldnews,montak22,coronavirusin.world,"A $6 trillion fund’s information to Gulf: Buy Qatar, keep away from Saudi",0,1,1588356790
175,worldnews,montak22,coronavirusin.world,‘You Cannot Kill David Arquette’ Wrestling Documentary Picked Up By Neon’s Super LTD,0,1,1588356790
176,worldnews,montak22,coronavirusin.world,"Matty Simmons, Producer of ‘Animal House’ and ‘Vacation’ Who Co-Founded National Lampoon, Dies at 93",0,1,1588356789
177,worldnews,montak22,coronavirusin.world,Ben Schwartz and Sam Rockwell to Star in Comedy at Searchlight Pictures,0,1,1588356788
178,worldnews,montak22,coronavirusin.world,‘Lovecraft Country’: Watch the Bloody First Trailer for Jordan Peele’s New HBO Series (Video),0,1,1588356787
179,worldnews,montak22,coronavirusin.world,Voice of America Reporter Says He Was Banned From Air Force Two Over Report on Mike Pence’s Maskless Mayo Clinic Visit,0,1,1588356787
180,worldnews,anxiouspapita,cnn.com,Chinese journalist jailed for 15 years for 'vilifying the Communist Party and government',31,1,1588356355
181,worldnews,I_Always_Talk_Shite,news.sky.com,Teenagers in Georgia to be given driving licence without taking test under new rules,13,1,1588356116
182,worldnews,anxiouspapita,edition.cnn.com,EU chief denies disinformation report was watered down for China,1,1,1588356048
183,worldnews,22mah22xaf,youtube.com,I predicted Kim Jong Un will die in year 2020 about 2 years ago. Watch my old video,2,1,1588356035
