,subreddit,author,domain,title,num_comments,score,timestamp
696,worldnews,angjiankai02,foxnews.com,"Australian capital is free of all known coronavirus cases, as infections continue to dwindle",4,1,1588256706
697,worldnews,angjiankai02,theguardian.com,"Clean air in Europe during lockdown ‘leads to 11,000 fewer deaths’ | Environment",1,1,1588256689
698,worldnews,SadAdhesiveness6,bloomberg.com,Taiwan Emerging From Pandemic With a Stronger Hand Against China,23,1,1588256629
699,worldnews,RoscoMan1,newsweek.com,"Deutsche Bank has ""reams"" of Trump documents including his tax returns for congressional investigators - Including internal corporate documents, parts of Trump's personal &amp; business tax returns as well as a detailed breakdown of the value of his assets.",0,1,1588256256
700,worldnews,Bergensis,reuters.com,Norway plans temporary tax relief for oil firms,0,1,1588256066
701,worldnews,montak22,coronavirusin.world,"NBCUniversal CEO: VOD Will Be ‘Complementary Ingredient,’ Not ‘Alternative’ for Theatrical Releases Publish-Pandemic",0,1,1588256004
702,worldnews,montak22,coronavirusin.world,"NBCUniversal CEO: VOD Will Be ‘Complementary Factor,’ Not ‘Alternative’ for Theatrical Releases Submit-Pandemic",0,1,1588256003
703,worldnews,montak22,coronavirusin.world,Trump Assaults MSNBC’s Brian Williams and Joe Scarborough in Late-Night time Tweet Storm: ‘Dumber Than Hell’,0,1,1588256002
704,worldnews,montak22,coronavirusin.world,Tajikistan declares first coronavirus circumstances,0,1,1588256002
705,worldnews,montak22,coronavirusin.world,Brian Roberts: Common Beijing Resort Set to Open ‘Amazingly on Time and on Price range in 2021’,0,1,1588256000
706,worldnews,montak22,coronavirusin.world,Quiet and desolate Ramadan in Kashmir amid back-to-back lockdowns,0,1,1588255999
707,worldnews,azatoth12,nbcnews.com,British doctors warn some Chinese ventilators could kill coronavirus patients if used in hospitals,24,1,1588255827
708,worldnews,ever0nand0n,foxnews.com,"Trump criticizes Sweden's no-lockdown stance after WHO praise, claims US made ‘correct decision’",38,1,1588255806
709,worldnews,WoolfordStudiosLtd,youtube.com,SwipeStrike Daily 30-04-2020,0,1,1588255714
710,worldnews,HKnational,theguardian.com,Chris Patten urges UK to investigate origins of coronavirus in China,10,1,1588255653
711,worldnews,Infjuk,news.sky.com,"Scientists have discovered a ""crazy beast"" mammal which broke 'evolutionary rules' and lived alongside dinosaurs on Madagascar approximately 66 million years ago. The official name Adalatherium hui, literally translates to ""crazy beast"".",25,1,1588255621
712,worldnews,GroundbreakingSale1,youtube.com,"How to align text ( Left, Right, Center, Justify ) in using HTML lrcture 5",0,1,1588255163
713,worldnews,speakhyroglyphically,reuters.com,"Captain Tom made honorary member of England team on 100th birthday | British World War Two veteran Captain Tom Moore, who has raised millions for the country’s National Health Service (NHS)",2,1,1588254923
714,worldnews,1Mishal,youtube.com,"Catherine Johnson a 101-year-old NASA human calculator, has died Comple...",2,1,1588253728
715,worldnews,ManiaforBeatles,theguardian.com,"Google has confirmed that one of its senior executives participated in the UK government’s scientific advisory group on Covid-19, raising further questions about the composition of the secretive committee.",5,1,1588252809
716,worldnews,mostaksaif,independent.co.uk,‘It’s gonna be eradicated’: Trump suggests coronavirus will disappear even without vaccine,156,1,1588252751
717,worldnews,rishcast,theguardian.com,'Utter disaster': Manaus fills mass graves as Covid-19 hits the Amazon,2,1,1588252747
718,worldnews,montak22,coronavirusin.world,Turkey’s spiritual directorate criticized over coronavirus,0,1,1588252403
719,worldnews,Radiant-Falcon,reuters.com,German social distancing will be extended to May 10: Merkel aide,1,1,1588252278
720,worldnews,kspkido1,reuters.com,Trump told Saudis: Cut oil supply or lose U.S. military support,8,1,1588252248
721,worldnews,Ra75b,reuters.com,Lufthansa pilots offer to sacrifice up to 45% of salary,5,1,1588251902
722,worldnews,dirtyviking1337,newsweek.com,"Deutsche Bank has ""reams"" of Trump documents including his tax returns for congressional investigators - Including internal corporate documents, parts of Trump's personal &amp; business tax returns as well as a detailed breakdown of the value of his assets.",0,1,1588251486
723,worldnews,motor_car,reuters.com,"After U.S., Israeli pressure, Germany bans Hezbollah activity, raids mosques",3,1,1588251477
724,worldnews,pnewell,reuters.com,Activist Thunberg helps launch effort protecting children from COVID-19,16,1,1588251010
725,worldnews,VeniciusSena,youtube.com,O desabafo de uma criança ao saber que vai voltar a morar com a mãe após decisão da justiça,1,1,1588250992
726,worldnews,motor_car,reuters.com,Swedish town uses chicken manure to help stop spread of coronavirus,6,1,1588250901
727,worldnews,pmcd_com,theguardian.com,Box jellyfish: Australian researchers find antidote for world's most venomous creature,0,1,1588250770
728,worldnews,wrapityup,time.com,California Governor Will Order All Beaches Closed to Stop Coronavirus — Gov. Gavin Newsom will order all beaches and state parks closed starting Friday after people thronged the seashore during a sweltering weekend despite his social distancing order that aims to slow the spread of the coronavirus,271,1,1588250572
729,worldnews,AngelofDeath2020,edition.cnn.com,"There will be no fans, but tennis is set for return in Germany amid pandemic: Tennis fans eagerly awaiting their next fix won't have to wait very long, with the first tournament in the coronavirus era set to begin in Germany on Friday.",2,1,1588250339
730,worldnews,Zhana-Aul,theguardian.com,"Condom sales down as lockdown limits sex lives, says Durex makers",278,1,1588250223
731,worldnews,vahvachanneltelugu,youtube.com,30 April 2020,1,1,1588249819
732,worldnews,JasmineDear,news.sky.com,Coronavirus: 50 corpses discovered in US trucks after neighbours noticed smell and leaks,461,1,1588249777
733,worldnews,DarkMaster_CocoaBean,vox.com,Who sews the masks? How women are shouldering the burden of pandemic preparedness.,0,1,1588249440
734,worldnews,alankyguy,bbc.co.uk,Captain Tom: RAF flypast in veteran's honour.,0,1,1588249087
735,worldnews,montak22,coronavirusin.world,"IMAX Experiences Q1 Loss, Income Decline Because of Coronavirus Pandemic",0,1,1588248794
736,worldnews,montak22,coronavirusin.world,"Twitter Reviews Report Quarterly Person Progress, Provides 14 Million Customers in Q1",0,1,1588248793
737,worldnews,montak22,coronavirusin.world,Qatar begins manufacturing ventilators amid coronavirus pandemic,0,1,1588248793
738,worldnews,montak22,coronavirusin.world,"IMAX Stories Q1 Loss, Income Decline Because of Coronavirus Pandemic",0,1,1588248792
739,worldnews,montak22,coronavirusin.world,Trump provides divisive immigration subject to debate over state assist,0,1,1588248792
740,worldnews,WoolfordStudiosLtd,youtube.com,Head Home Daily 30-04-2020,0,1,1588248505
741,worldnews,sunflowerhs,reuters.com,Special Report: Trump told Saudis: Cut oil supply or lose U.S. military support - sources,939,1,1588247346
742,worldnews,uhujkill,bbc.co.uk,Mobile cinema brings movies to Madrid balconies - BBC News,0,1,1588247029
743,worldnews,apple_kicks,independent.co.uk,"Boris Johnson is still secretly ‘seeking to create herd immunity’ to defeat pandemic, ex-chief scientistic adviser suggests",124,1,1588246449
744,worldnews,min-1,bbc.co.uk,Captain Tom Moore given colonel title on 100th birthday,348,1,1588246021
745,worldnews,wiserico,youtube.com,Public and municipal facilities such as Dubai Police and Dubai Central Laboratories Department have already set special smart sterilization equipment and furnished the entrances with the SterixGate to keep the employees and the visitors safe.,0,1,1588245710
746,worldnews,Vishal201,youtube.com,New VISION GAMING video: diamond💎 Free Fire stream 3000 diamond💎 giveway win 🏆 prize free free 🆓 Noobgame play 🎮 😂,0,1,1588245559
747,worldnews,Tea-Loving_Linguist,nbcnews.com,British doctors warn some Chinese ventilators could kill if used in hospitals,354,1,1588245457
748,worldnews,Tea-Loving_Linguist,reuters.com,"After U.S., Israeli pressure, Germany bans Hezbollah activity, raids mosques",15,1,1588245411
749,worldnews,Acrzyguy,nbcnews.com,"Trump administration asks intelligence agencies to find out whether China, WHO hid info on coronavirus pandemic",68,1,1588245316
750,worldnews,Marcmin,time.com,What Asian and Pacific Countries Can Teach the World About How to—and How Not to—Reopen Our Economies,1,1,1588245254
751,worldnews,Marcmin,time.com,"As Coronavirus Cases Rise, Brazilian President Jair Bolsonaro Faces Another Snag: Corruption Charges",27,1,1588245254
752,worldnews,grepnork,independent.co.uk,Germany bans Hezbollah and launches police raids to find suspected supporters,2,1,1588245202
753,worldnews,montak22,coronavirusin.world,China says it has no real interest in meddling in US elections,0,1,1588245195
754,worldnews,montak22,coronavirusin.world,Why Arabs are talking out towards Islamophobia in India,0,1,1588245194
755,worldnews,montak22,coronavirusin.world,Leak issues fuelled coronavirus therapy revelation: US physician,0,1,1588245194
756,worldnews,montak22,coronavirusin.world,Syria: Al-Assad accused of disrupting medical provides,0,1,1588245193
757,worldnews,montak22,coronavirusin.world,Qatar produces new synthetic ventilators to fight coronavirus,0,1,1588245192
758,worldnews,Ra75b,reuters.com,Europe flooded with cocaine despite coronavirus trade disruptions,6,1,1588244516
759,worldnews,kspkido1,reuters.com,Trump says China wants him to lose his bid for re-election,7,1,1588243699
760,worldnews,undue-influence,france24.com,"Germany bans Hezbollah, raids mosques",2,1,1588243569
761,worldnews,sarahN69,reuters.com,Pandemic-hit Macau casinos look to play the long game with cash pile,3,1,1588243278
762,worldnews,iLoveBlogging247,reuters.com,Shell cuts dividend for first time since World War Two,1,1,1588242498
763,worldnews,tester_tester2,theguardian.com,Box jellyfish: Australian researchers find antidote for world's most venomous creature,0,1,1588242473
764,worldnews,madazzahatter,theguardian.com,"Supermarkets have been urged to welcome all families “with kindness and compassion”, following a surge in reports of single parents across Scotland being challenged or turned away by staff and abused by members of the public as they try to shop with their children.",19,1,1588242131
765,worldnews,thefunkylemon,reuters.com,Service with a (masked) smile as Germany reopens stores,7,1,1588242111
766,worldnews,madazzahatter,theguardian.com,France is to sell off some of the nation’s antique furniture to support the country’s hard-pressed hospitals. The Mobilier National – the national furniture collection – is drawing up a list of objects in storage that will be auctioned off in September.,20,1,1588242046
767,worldnews,thefunkylemon,reuters.com,Trump's tariffs add to pandemic-induced turmoil of U.S. manufacturers,2,1,1588241782
768,worldnews,SeleniumF0rest,theguardian.com,Venezuela: Guaidó says 'final phase' of plan to oust Maduro has begun,0,1,1588241722
769,worldnews,montak22,coronavirusin.world,"European lockdowns ‘may avert 11,300 air air pollution deaths’",0,1,1588241603
770,worldnews,montak22,coronavirusin.world,New York Metropolis mayor accused of singling out Jewish neighborhood,0,1,1588241602
771,worldnews,montak22,coronavirusin.world,Dozens of our bodies present in vehicles in New York Metropolis,0,1,1588241601
772,worldnews,WoolfordStudiosLtd,youtube.com,Sweets Skyscraper Daily 30-04-2020,0,1,1588241288
773,worldnews,WoolfordStudiosLtd,youtube.com,Square Chase Daily 30-04-2020,0,1,1588241286
774,worldnews,Defiant-Month,cnn.com,"Whistleblowers: Company at heart of 97,000% drug price hike bribed doctors to boost sales",0,1,1588240584
775,worldnews,mstfcim,youtube.com,"🇹🇷Turkey repatriated over 60,000 citizens from 71 countries.",2,1,1588240450
776,worldnews,Zhana-Aul,news.sky.com,UK NHS fundraising hero Tom Moore passes £30m on his 100th birthday,8,1,1588240369
777,worldnews,SeleniumF0rest,washingtonpost.com,"Mueller told the attorney general that the depiction of his findings failed to capture ‘context, nature, and substance’ of probe",2,1,1588240210
778,worldnews,kapetankuka,theguardian.com,"South Korea records no new domestic cases of Covid-19 for first time since February, even after having elections",3,1,1588239951
779,worldnews,avrishisooli,google.com,Almost 200 deaths in Israel: Health Minister Announces He Will Resign,1,1,1588239402
780,worldnews,BrendanIrish,theguardian.com,"Revealed: 100,000 crew never made it off cruise ships",9,1,1588239150
781,worldnews,montak22,coronavirusin.world,Demise at a distance: Zoom funerals within the time of coronavirus,0,1,1588237982
782,worldnews,BJSHOPUNE,youtube.com,Mumbai Mobile Van Dispensary Seva #BJSMission,0,1,1588237836
783,worldnews,BobMcCully,theguardian.com,"Revealed: 100,000 crew never made it off cruise ships",1,1,1588237829
784,worldnews,Tea-Loving_Linguist,reuters.com,"Travellers rejoice, flight bookings surge as China's capital relaxes curbs",2,1,1588237807
785,worldnews,Tea-Loving_Linguist,reuters.com,"Travellers rejoice, flight bookings surge as China's capital relaxes curbs",0,1,1588237777
786,worldnews,Tea-Loving_Linguist,reuters.com,China says it has no interest in meddling in U.S. election,36,1,1588237623
787,worldnews,Tea-Loving_Linguist,reuters.com,Clash of tech titans: Zuckerberg praises coronavirus lockdowns; Musk sees 'fascism',5,1,1588237582
788,worldnews,tester_tester2,theguardian.com,Box jellyfish: Australian researchers find antidote for world's most venomous creature,0,1,1588237515
789,worldnews,ravsahebsarpanch,theguardian.com,Shell cuts dividend for first time since 1945 amid oil price collapse,13,1,1588237337
790,worldnews,princey12,newsweek.com,Trust in Vladimir Putin falls to 14-year low as Russia government faces criticism over coronavirus response: poll,0,1,1588236172
791,worldnews,GOR098,bbc.co.uk,Coronavirus: Trump says China wants him to lose re-election,2,1,1588236164
792,worldnews,xutti,uk.reuters.com,"Russia's coronavirus case tally surges past the 100,000 mark after record daily rise",6,1,1588236005
793,worldnews,HKnational,reuters.com,Trump says China wants him to lose his bid for re-election,6,1,1588235676
794,worldnews,SeleniumF0rest,reuters.com,Iran designates as terrorists all U.S. troops in Middle East,0,1,1588235289
795,worldnews,jminhluu51,google.com,(Australia) Victorian Deputy Chief Health Officer sparks Opposition outrage by comparing coronavirus to arrival of Captain Cook,0,1,1588235028
796,worldnews,Tea-Loving_Linguist,independent.co.uk,Boris Johnson set to take paternity leave by end of June,18,1,1588235010
797,worldnews,Marcmin,time.com,Bollywood Actor Rishi Kapoor Dies at Age 67,0,1,1588234453
798,worldnews,SerendipityQuest,reuters.com,Hungary fines Booking.com operator 6.1 million pounds for unfair practices,0,1,1588234446
799,worldnews,montak22,coronavirusin.world,Afghanistan pressured to launch prisoners as healthcare collapses,0,1,1588234382
800,worldnews,montak22,coronavirusin.world,Can Eritrea’s authorities survive the coronavirus?,0,1,1588234381
801,worldnews,montak22,coronavirusin.world,COVID-19 vaccine trials beginning in UK,0,1,1588234381
802,worldnews,pmcd_com,bbc.co.uk,"Japan's Emperor Akihito declares his abdication, becoming the first Japanese monarch to step down from the throne in more than 200 years",0,1,1588234380
803,worldnews,andbjo,in.reuters.com,"European lockdowns could avert 11,300 air pollution deaths – report",5,1,1588233641
804,worldnews,Sgsejdv,google.com,Indian troops violating the ceasefire agreement on Pakistan's Line of Control during a pandemic,2,1,1588233639
805,worldnews,plugwater,nytimes.com,India's Serum Institute to Make Millions of Potential Coronavirus Vaccine Doses,4,1,1588233420
806,worldnews,Admiral_Asado,reuters.com,Trump says China wants him to lose his bid for re-election,1,1,1588233167
807,worldnews,azatoth12,newsweek.com,"China and Russia unite to condemn ""hazardous"" American microbiology laboratories in former Soviet states",3,1,1588233085
808,worldnews,MiltonCiaraldi,news.sky.com,Trans man who gave birth loses latest appeal to be known as his child's father,6,1,1588233046
809,worldnews,UnmannedUser,france24.com,"Germany designates Hezbollah as terrorist group, conducts raids on suspects",2,1,1588232888
810,worldnews,reyvillegas1,youtube.com,Así es el día a día de los médicos que luchan contra el coronavirus en Moscú,0,1,1588231912
811,worldnews,maxwellhill,newsweek.com,"China and Russia unite to condemn ""hazardous"" American laboratories in former Soviet states: China complained that U.S. laboratories in former Soviet states could pose a public health risk, one day after a Russian official made the same allegation",141,1,1588231533
812,worldnews,montak22,coronavirusin.world,Philippines backs down on demand for Taiwan to deport employee,0,1,1588230784
813,worldnews,montak22,coronavirusin.world,South Korea studies no new native instances of coronavirus,0,1,1588230782
814,worldnews,thinkB4WeSpeak,nbcnews.com,"First drugs, then oil, now Mexican cartels turn to human trafficking",10,1,1588229553
815,worldnews,chotu_ustaad,edition.cnn.com,"How does India, a country of 1.3 billion people, have around 1,000 coronavirus deaths? - CNN",0,1,1588229155
816,worldnews,Lolastic_,theguardian.com,"Clean air in Europe during lockdown ‘leads to 11,000 fewer deaths’",111,1,1588229088
817,worldnews,Gnurx,theguardian.com,Trump claims China will 'do anything' to stop his re-election as coronavirus row escalates,2,1,1588228776
818,worldnews,Jeffrey_Strange,nytimes.com,"After Tesla’s profit plummets, Elon Musk calls California’s lockdown ‘fascist.’",5,1,1588228688
819,worldnews,WoolfordStudiosLtd,youtube.com,Deep Dive Daily 30-04-2020,0,1,1588228684
820,worldnews,Billthe-Uncle,washingtonpost.com,China is found attempting to Shape Coronavirus Narratives through Social Media Ads,0,1,1588228191
821,worldnews,RobinGill29,cnn.com,Up to 60 bodies found in four trucks outside Brooklyn funeral home,3,1,1588227422
822,worldnews,montak22,coronavirusin.world,"Rishi Kapoor, Indian Film Star, Producer and Director, Dies at 67",0,1,1588227201
823,worldnews,montak22,coronavirusin.world,S Korea reviews no new home coronavirus circumstances: Dwell updates,0,1,1588227200
824,worldnews,montak22,coronavirusin.world,Quibi Leaked New Person E mail Addresses for the First Three Weeks After Launch,0,1,1588227199
825,worldnews,SeleniumF0rest,theguardian.com,International Space Station hit by major power shortage,0,1,1588227155
826,worldnews,murari222,in.reuters.com,"Germany classifies Hezbollah as terrorist organisation, conducts raids",1,1,1588227028
827,worldnews,Tea-Loving_Linguist,edition.cnn.com,US Navy stages back-to-back challenges to Beijing's South China Sea claims,3,1,1588226511
828,worldnews,Tea-Loving_Linguist,edition.cnn.com,UK House of Lords cuts livestream after accidentally broadcasting personal phone numbers,0,1,1588226430
829,worldnews,Tea-Loving_Linguist,theguardian.com,Pressure mounts on Joe Biden to address sexual assault claim | US news,5,1,1588226000
830,worldnews,Ihoardtoiletpaper,newsweek.com,Australia rebuffs China boycott threat to press for international inquiry into pandemic origins,61,1,1588225940
831,worldnews,Tea-Loving_Linguist,independent.co.uk,China bans zombie game based on coronavirus pandemic,4,1,1588225874
832,worldnews,Tea-Loving_Linguist,independent.co.uk,New York governor sued for failing to provide interpreters at coronavirus press briefings,5,1,1588225844
833,worldnews,wrapityup,newsweek.com,World Health Organization Chief Thanks His 'Friend' Russian Foreign Minister Lavrov for 'Trust and Support' During Coronavirus Pandemic,1,1,1588225836
834,worldnews,Tea-Loving_Linguist,independent.co.uk,Trump falsely claims he never said US could test 5m a day for Covid-19 'very soon',7,1,1588225793
835,worldnews,tester_tester2,independent.co.uk,"China deploys 60,000 soldiers to plant trees in bid to grow 6 million hectares of new forest this year",2,1,1588225775
836,worldnews,Tea-Loving_Linguist,independent.co.uk,Here's how experts think American society will look after the coronavirus pandemic,3,1,1588225738
837,worldnews,food_is_bad,uk.reuters.com,"Germany classifies Hezbollah as terrorist organisation, conducts raids - Reuters",47,1,1588225571
838,worldnews,azatoth12,nytimes.com,Pompeo tells russia any new arms control talks must include china,9,1,1588225143
839,worldnews,DoremusJessup,france24.com,"Swedish climate activist Greta Thunberg has donated a $100,000 prize she won from a Danish foundation to the United Nations Children's Fund (UNICEF) for use against the COVID-19 pandemic, the world body said Thursday",3973,1,1588224632
840,worldnews,montak22,coronavirusin.world,Sudden collapse: China’s factories hunch on low world demand,0,1,1588223600
841,worldnews,iyoiiiu,theguardian.com,Trump claims China will 'do anything' to stop his re-election as coronavirus row escalates - President again raises possible retaliation against Beijing over coronavirus as Chinese media criticises lack of leadership in the US,18,1,1588223467
842,worldnews,Zhana-Aul,bbc.co.uk,"Captain Tom Moore, who raised more than £29m for the NHS by walking laps of his garden, has been made an honorary colonel on his 100th birthday.",0,1,1588223249
843,worldnews,greatidea7,youtube.com,How to active your CARE EMOJI on facebook?,2,1,1588222640
844,worldnews,MrTezzie,google.com,Bollywood actor Rishi Kapoor passes away at 67 to cancer,0,1,1588221783
845,worldnews,AdrienSergent,bloomberg.com,Vodafone Found Hidden Backdoors in Huawei Equipment,2,1,1588221743
846,worldnews,LesterBePiercin,cnn.com,"Elon Musk criticizes coronavirus stay-at-home orders, calling them 'fascist'",28,1,1588221690
847,worldnews,dirtyviking1337,reuters.com,Tesla to reduce solar panel prices by up to 38 percent,0,1,1588221548
848,worldnews,humanuniverse1,theguardian.com,"‘We were behind the eight ball’ says Papua New Guinea’s health minister on Covid-19: The Pacific nation is dealing with outbreaks of malaria, dengue fever, drug-resistant tuberculosis and had a recent outbreak of polio.",4,1,1588220449
849,worldnews,erikwh,cnn.com,Wuhan shows the world that the end of lockdown is just the beginning of the Covid-19 crisis,30,1,1588220378
850,worldnews,llkaavyadll,edition.cnn.com,Juventus striker Paulo Dybala is still positive for the coronavirus six weeks after initially contracting it,0,1,1588219844
851,worldnews,How_art_thou_fallen_,washingtonexaminer.com,"Like Satan the accuser, Trump uses sexual assault allegations against his opponent, Joe Biden",19,1,1588219822
852,worldnews,SeleniumF0rest,cnn.com,"Whistleblowers: Company at heart of 97,000% drug price hike bribed doctors to boost sales",0,1,1588219432
853,worldnews,rick9674,reuters.com,Two dozen people deported to Colombia on U.S. flight found to have coronavirus: sources,1,1,1588218724
854,worldnews,vv4life,reuters.com,New York police break up massive crowd at rabbi's funeral that defied virus shutdown,1,1,1588218608
855,worldnews,amoavo,theguardian.com,Revealed: the inside story of the UK's Covid-19 crisis | The Guardian,0,1,1588218124
856,worldnews,VoxPopuli74,news.sky.com,Captain Tom Moore promoted to colonel on his 100th birthday,18,1,1588218087
857,worldnews,RoscoMan1,theguardian.com,International Space Station hit by major power shortage,0,1,1588217766
858,worldnews,azatoth12,nytimes.com,"UK Backs Washington Probe Into Origins of Pandemic, WHO Reforms",16,1,1588217505
859,worldnews,Balls_of_Adamanthium,reuters.com,"South Korea reports no new domestic coronavirus cases, first time since Feb peak",1,1,1588217034
860,worldnews,AlexxLopaztico02,reuters.com,Venezuela asks Bank of England to sell its gold to U.N. for coronavirus relief - sources,7,1,1588216910
861,worldnews,AlexxLopaztico02,reuters.com,Exclusive: Venezuela asks Bank of England to sell its gold to U.N. for coronavirus relief - sources,1,1,1588216860
862,worldnews,CruelRealityBites,nbcnews.com,Magnitude 4.5 earthquake strikes Cuba's Guantanamo province,0,1,1588216733
863,worldnews,ketobhb,youtube.com,"Infowars, Antifa ATTACK &amp; FAKE NEWS - That's the Point with Brandon",0,1,1588216577
864,worldnews,montak22,coronavirusin.world,"Boeing confirms workers cuts, decreasing output and fundraising",0,1,1588216383
865,worldnews,Defiant-Month,edition.cnn.com,"Scientists in Chile have found a 15,000-year-old footprint, the earliest sign of humans' presence in the Americas",0,1,1588213775
866,worldnews,azatoth12,reuters.com,China opposes international coronavirus probe that presumes its guilt,10,1,1588213438
867,worldnews,azatoth12,reuters.com,China resolutely opposes international coronovirus probe that presumes its guilt,0,1,1588213404
868,worldnews,Hi-archy,theguardian.com,"KFC to reopen further 80 outlets in UK, bringing total to 100",1,1,1588213261
869,worldnews,dirtyviking1337,cnn.com,"Whistleblowers: Company at heart of 97,000% drug price hike bribed doctors to boost sales",0,1,1588213149
870,worldnews,A_Modern_Publicus,washingtonpost.com,Putin has just made two huge mistakes — and his timing couldn’t be worse,0,1,1588213021
871,worldnews,Marcmin,time.com,Italy Says App Tracing Contacts of People Infected With COVID-19 Will Be Anonymous,4,1,1588212845
872,worldnews,montak22,coronavirusin.world,New York Submit Lays Off About 20 Workers Members Throughout Firm,0,1,1588212785
873,worldnews,montak22,coronavirusin.world,"Josh Cooley to Direct Animated ‘Transformers’ Prequel For Hasbro, eOne and Paramount",0,1,1588212785
