,subreddit,author,domain,title,num_comments,score,timestamp
2090,worldnews,nolesfan2011,theguardian.com,Fijian military leader defends government's right to 'stifle' press during Covid crisis,2,1,1587968860
2091,worldnews,nolesfan2011,theguardian.com,Pandemic jeopardises support for world's poor as charities lose millions,2,1,1587968830
2092,worldnews,nolesfan2011,washingtonpost.com,Mideast economies take massive hit with oil price crash,1,1,1587968722
2093,worldnews,checkmak01,reuters.com,Asian LNG (liquefied natural gas) prices take bigger coronavirus hit than Brent crude,0,1,1587968577
2094,worldnews,kommie,bloomberg.com,Poland’s Plan to Hold Election in Lockdown Faces Fresh Headwinds,2,1,1587968432
2095,worldnews,IdahoAnalytic,theguardian.com,Sex Education creator Laurie Nunn: 'You can't make sex scenes flowery!',1,1,1587968366
2096,worldnews,IdahoAnalytic,theguardian.com,Pandemic jeopardises support for world's poor as charities lose millions,3,1,1587968365
2097,worldnews,SaulKD,nytimes.com,Dozens of Gay Men Are Outed in Morocco as Photos Are Spread Online,3,1,1587968277
2098,worldnews,justanusernamedano,google.com,Fake news about Vietnam using black cats to treat Covid-19 are being spreaded,0,1,1587968131
2099,worldnews,nolesfan2011,nytimes.com,"Kashmir, Under Siege and Lockdown, Faces a Mental Health Crisis",2,1,1587968093
2100,worldnews,nolesfan2011,theguardian.com,Locked-down advertisers ask: is it too soon for jokes?,0,1,1587967843
2101,worldnews,Majnum,time.com,This Japanese Island Lifted Its Coronavirus Lockdown Too Soon and Became a Warning to the World,3,1,1587967802
2102,worldnews,some-tortel,google.com,Kim Jong Un is alive and well amid speculation,0,1,1587967467
2103,worldnews,SaulKD,washingtonpost.com,"A pandemic of corruption: $40 masks, questionable contracts, rice-stealing bureaucrats mar coronavirus response",9,1,1587967284
2104,worldnews,SaulKD,washingtonpost.com,"A pandemic of corruption: $40 masks, questionable contracts, rice-stealing bureaucrats mar coronavirus response (Colombia)",1,1,1587967241
2105,worldnews,IdahoAnalytic,theguardian.com,Wuhan discharges all coronavirus patients as Beijing takes steps to stop second wave,25,1,1587966550
2106,worldnews,Tesg9029,japantimes.co.jp,Leiji Matsumoto cartoon auctioned to aid Italian hospital that treated him,1,1,1587965961
2107,worldnews,montak22,coronavirusin.world,Coronavirus quandary: Some sufferers in S Korea get virus once more,0,1,1587965543
2108,worldnews,montak22,coronavirusin.world,US banks see lending capped after small corporations lose out on funding,0,1,1587965542
2109,worldnews,montak22,coronavirusin.world,Italy to loosen lockdown from Might 4: Coronavirus stay updates,0,1,1587965541
2110,worldnews,NoSleepNYC,google.com,Chinese students don’t need to learn STEM from US universities,0,1,1587965181
2111,worldnews,paone22,theguardian.com,"'Heads we win, tails you lose': how America's rich have turned pandemic into profit | As 26 million Americans lose their jobs, the billionaire class has added $308bn to its wealth",126,1,1587963276
2112,worldnews,Pleasant-Force,vox.com,Governors say Trump’s disinfectant comments prompted hundreds of poison center calls,6,1,1587963106
2113,worldnews,IdahoAnalytic,nytimes.com,Your Monday Briefing,1,1,1587962376
2114,worldnews,IdahoAnalytic,nytimes.com,Kim Jong-un’s Absence and North Korea’s Silence Keep Rumor Mill Churning,3,1,1587962375
2115,worldnews,IdahoAnalytic,nytimes.com,"Global Coronavirus Death Toll Crosses 200,000; Italy to Ease Restrictions in May: Live World Coverage",2,1,1587962375
2116,worldnews,DoremusJessup,france24.com,"Demonstrators blocked roads through Lebanon late Sunday to protest the deteriorating economic situation, despite a lockdown and curfew imposed because of the coronavirus. Police quickly intervened to reopen the highways where the demonstrators burned tyres to block roads",1,1,1587962322
2117,worldnews,qhassan2,nytimes.com,David Chang Isn’t Sure the Restaurant Industry Will Survive Covid-19,5,1,1587962089
2118,worldnews,CurrentlyCurious,theguardian.com,New Zealand prepares to lift strict lockdown after 'eliminating' coronavirus,3,1,1587960748
2119,worldnews,IdahoAnalytic,nytimes.com,South Korea Confident That Rumors of Kim Jong-un Illness Are Wrong,5,1,1587960549
2120,worldnews,IdahoAnalytic,nytimes.com,"To Pressure Iran, Pompeo Turns to the Deal Trump Renounced",2,1,1587960548
2121,worldnews,totatree,reuters.com,Italy to reopen factories in staged end to coronavirus lockdown,3,1,1587960255
2122,worldnews,AdrienSergent,independent.co.uk,Support for EU membership above 80% in most member states amid Brexit mess,2,1,1587960189
2123,worldnews,totatree,reuters.com,Starbucks says in partnership with Sequoia Capital China for investments,4,1,1587960188
2124,worldnews,maxwellhill,theguardian.com,Even western countries are starting to accept that shielding our faces could save lives … whether you live in New York or Berlin,67,1,1587959595
2125,worldnews,hitthehive,edition.cnn.com,Indian man travels 1400 kms after buying 28 tons of onions to disguise himself as a seller to bypass the lockdown.,0,1,1587957995
2126,worldnews,Tommy__Douglas,theguardian.com,Are female leaders more successful at managing the coronavirus crisis?,5,1,1587957837
2127,worldnews,dcismia,reuters.com,"Italy's daily coronavirus death toll lowest since March 14, new cases fall",2,1,1587957714
2128,worldnews,DoremusJessup,france24.com,"French police have seized 140,000 face masks intended for the black market in a record haul since the start of the coronavirus pandemic. It is the largest seizure since the French government banned the resale of protective masks to prioritize their distribution to health workers",12,1,1587957189
2129,worldnews,Solar_Energy1,youtube.com,"Stats, Expertise, and COMMON SENSE !!! This is long, but SO good!",2,1,1587956830
2130,worldnews,cc_hk,theguardian.com,"Kim Jong-un is 'alive and well', says South Korea's security adviser",14,1,1587956495
2131,worldnews,SirT6,theguardian.com,UK COVID-19 vaccine trial volunteer says she is 'doing fine' after anti-vax groups circulated online death rumours,42,1,1587956441
2132,worldnews,ChocolaWeeb,washingtonpost.com,"Dong-a Ilbo, a South Korean newspaper, cited a U.S. official in Washington saying Kim had been seen walking around in Wonsan.",2,1,1587956229
2133,worldnews,IMissFreedom,foxnews.com,Tom Cotton suggests Chinese students shouldn't be allowed to study sciences in the US,61,1,1587956103
2134,worldnews,The_Hoolegan,cnn.com,"Amazon revealed to be behind mystery $310,000 donation to bookshops",23,1,1587956081
2135,worldnews,IMissFreedom,reuters.com,South African Airways faces wind-down or liquidation as cash runs out,1,1,1587955686
2136,worldnews,Upset-Pumpkin,reuters.com,South Korean officials call for caution amid reports that North Korean leader Kim is ill,1,1,1587955435
2137,worldnews,GetOutOfTheWhey,theguardian.com,Climate science deniers at forefront of downplaying coronavirus pandemic | Coronavirus outbreak,26,1,1587955073
2138,worldnews,IdahoAnalytic,theguardian.com,"Kim Jong-un is 'alive and well', says South Korea's security adviser",1,1,1587954844
2139,worldnews,montak22,coronavirusin.world,‘Westworld’: What Occurred When Dolores Flipped That Swap?,0,1,1587954753
2140,worldnews,montak22,coronavirusin.world,"Every thing That Occurred in ‘Westworld’ Season three Ep 7, Defined",0,1,1587954751
2141,worldnews,montak22,coronavirusin.world,Extra US states set to ease coronavirus lockdown measures,0,1,1587954750
2142,worldnews,montak22,coronavirusin.world,Kevin Smith Says His ‘Mallrats’ Sequel Script ‘Strikes Like a Brakeless Bullet Practice!’,0,1,1587954749
2143,worldnews,rick9674,in.reuters.com,Netanyahu 'confident' U.S. will allow West Bank annexation in two months,3,1,1587954602
2144,worldnews,coronkhan,edition.cnn.com,Kim Jong alive,0,1,1587954122
2145,worldnews,M7plusoneequalsm8,foxnews.com,"Iran's military satellite a 'tumbling webcam in space,' Space Force commander says",32,1,1587952537
2146,worldnews,IdahoAnalytic,theguardian.com,Brad Pitt plays Dr Anthony Fauci in Saturday Night Live sketch,0,1,1587952143
2147,worldnews,IdahoAnalytic,theguardian.com,Melbourne woman accused of driving car onto train station's pedestrian overpass,0,1,1587952142
2148,worldnews,llllIlIlllll,nytimes.com,Dozens of Gay Men Are Outed in Morocco as Photos Are Spread Online,15,1,1587951651
2149,worldnews,planetarynews,reuters.com,Mexico all but empties official migrant centers in bid to contain coronavirus,1,1,1587950966
2150,worldnews,hanyhuh,cnn.com,"From private testing for the rich to unrest in banlieues, coronavirus is highlighting France's stark divide",1,1,1587950665
2151,worldnews,Defiant-Month,independent.co.uk,Support for EU membership above 80% in most member states amid Brexit mess,2,1,1587950198
2152,worldnews,IdahoAnalytic,independent.co.uk,Coronavirus: House of Congress worries about its effectiveness during pandemic,8,1,1587949279
2153,worldnews,IdahoAnalytic,independent.co.uk,Coronavirus: Italy to begin phased lifting of lockdown with reopening of some businesses next week,7,1,1587949278
2154,worldnews,madazzahatter,independent.co.uk,"Releasing bison, reindeer and horses into the Arctic would slow warming, say scientists. A computerised simulation of conditions at the polar region found that with enough wildlife, 80 per cent of the world’s permafrost soils could be saved, preventing a vicious circle of environmental catastrophe.",308,1,1587949014
2155,worldnews,NeverEndingDClock,bbc.co.uk,Hong Kong Judge sympathizes with man who stabbed protesters,1,1,1587948882
2156,worldnews,madazzahatter,reuters.com,"South Korea’s large churches reopened on Sunday, requiring worshipers to keep their distance and wear masks, after the government relaxed restrictions on religious gatherings aimed at slowing the spread of the coronavirus.",2,1,1587948841
2157,worldnews,Defiant-Month,edition.cnn.com,"More than 41,000 people will run the London Marathon on Sunday. When they reach mile 23, they'll be handed edible pods made of seaweed extracts instead of a plastic water bottle.",0,1,1587948667
2158,worldnews,IdahoAnalytic,theguardian.com,"Coronavirus numbers in Australia: how many new cases are there? Covid-19 map, statistics and graph",0,1,1587948557
2159,worldnews,motor_car,bloomberg.com,Saudi Arabia Cuts $265 Million Deal With China to Fight Virus,8,1,1587948113
2160,worldnews,BattlemechJohnBrown,theguardian.com,"Milan announces ambitious scheme to reduce car use after lockdown | Milan is to introduce one of Europe’s most ambitious schemes reallocating street space from cars to cycling and walking, in response to the coronavirus. The city has announced that 35km of streets will be transformed over the summer",20,1,1587947504
2161,worldnews,That1Cockysoab420,theguardian.com,Saudi Arabia ends death penalty for minors,4,1,1587947192
2162,worldnews,dustofoblivion123,foxnews.com,"With Kim Jong Un’s health uncertain, focus shifts to powerful sister Kim Yo Jong: North Korea’s male-dominated Kim dynasty may be about to hand over the keys to the Hermit Kingdom to a woman.",8,1,1587946802
2163,worldnews,StrictElephante,reuters.com,Amazon tests screening new merchants for fraud via video calls in pandemic,2,1,1587946671
2164,worldnews,madazzahatter,independent.co.uk,Billionaire media mogul Kerry Stokes and wife managed to dodge mandatory hotel quarantine after returning to western Australia from ski trip in Colorado. Instead couple will spend quarantine period in their mansion in Perth. Stokes was given exemption to the rules by Australian government.,8,1,1587946202
2165,worldnews,Setagaya-Observer,japantimes.co.jp,"Tokyo records just 72 coronavirus cases Sunday, in lowest daily figure since April 1 | The Japan Times",5,1,1587946110
2166,worldnews,madazzahatter,reuters.com,"Chinese diplomats approached German government officials in an attempt to encourage them to make positive statements on how Beijing is handling the coronavirus pandemic, the German interior ministry said in a letter this month.",4,1,1587945547
2167,worldnews,Tommy__Douglas,edition.cnn.com,"Spanish soccer league delays Covid-19 tests for players, who ask that health workers be prioritized",10,1,1587944901
2168,worldnews,dirtyviking1337,cnn.com,Interpol: 157 children rescued from West Africa trafficking ring,0,1,1587944630
2169,worldnews,StrictElephante,reuters.com,Mexico all but empties official migrant shelters under coronavirus,2,1,1587944279
2170,worldnews,IdahoAnalytic,theguardian.com,Coronavirus live news: Boris Johnson back in Number 10 as Trump denies he plans to fire health secretary,3,1,1587944065
2171,worldnews,montak22,coronavirusin.world,‘Duck Dynasty’ Star Willie Robertson’s Residence Is Goal of Drive-By Capturing,0,1,1587943922
2172,worldnews,hanyhuh,nytimes.com,"Pressured by China, E.U. Softens Report on Covid-19 Disinformation",2,1,1587943820
2173,worldnews,dirtyviking1337,edition.cnn.com,"More than 41,000 people will run the London Marathon on Sunday. When they reach mile 23, they'll be handed edible pods made of seaweed extracts instead of a plastic water bottle.",0,1,1587943550
2174,worldnews,IdahoAnalytic,nytimes.com,Can Antibody Tests Help End the Coronavirus Pandemic?,2,1,1587942562
2175,worldnews,motor_car,reuters.com,Italy to start lifting coronavirus lockdown from May 4,43,1,1587942300
2176,worldnews,Infjuk,news.sky.com,"Coronavirus: 'Test, Trace, Isolate' - Iceland PM Says Strict Strategy Has Controlled Outbreak.",24,1,1587942283
2177,worldnews,kim82351,washingtonexaminer.com,Bill Gates calls question about whether China covered up the coronavirus a 'distraction',10,1,1587942006
2178,worldnews,OnePlinko,metro.co.uk,63-year-old British pimp was sentenced to 29 years for forcing multiple women into prostitution,8,1,1587941924
2179,worldnews,IdahoAnalytic,thesun.co.uk,Kim Jong-un death reports spark panic-buying in North Korea with fears of impending power struggle in Pyongyang,94,1,1587941415
2180,worldnews,r3dd3v1l,cnn.com,"Maryland has received 'hundreds of calls' about the effectiveness of ingesting disinfectants to treat coronavirus, governor says",7,1,1587941297
2181,worldnews,tester_tester2,theguardian.com,Uranium miner coaxed government to water down extinction safeguards - A multinational uranium miner persuaded the federal government to drop a requirement forcing it to show that a mine in outback Western Australia would not make any species extinct before it could go ahead.,0,1,1587941209
2182,worldnews,IdahoAnalytic,theguardian.com,Met Office predicts wet weather and falling temperatures this week,1,1,1587940464
2183,worldnews,Upstairs-Implement,youtube.com,Llano Police Department nearly wiped out in series of indictments,0,1,1587940173
2184,worldnews,Ra75b,reuters.com,Vast majority of Mexicans back president's handling of coronavirus,3,1,1587939805
2185,worldnews,Upstairs-Implement,youtube.com,US Marine vs US Army Soldier FEMALE Edition Truck Pull Competition,0,1,1587939804
2186,worldnews,IdahoAnalytic,theguardian.com,Baby and three-year-old stabbed to death at house in east London,0,1,1587939567
2187,worldnews,IdahoAnalytic,theguardian.com,Coronavirus Australia update latest: WA residents wake up to loosened restrictions as 1 million download tracing app – live news,1,1,1587939566
2188,worldnews,sophia-69,theguardian.com,France: public support for strict lockdown drops below 50%,13,1,1587938956
2189,worldnews,ilikecakenow,cnn.com,Indian man buys 28 tons of onions and drives 869 miles disguised as an onion seller to beat lockdown,7,1,1587938738
2190,worldnews,eugray,theguardian.com,Donald Trump set to fall back on xenophobia with re-election plan in tatters,4,1,1587937811
2191,worldnews,Panaka,nytimes.com,Boeing Terminates $4.2 Billion Deal to Buy Stake in Embraer Unit,2,1,1587937633
2192,worldnews,abdulakbarkhan500047,youtube.com,Need Subcribers,2,1,1587937416
2193,worldnews,Ra75b,reuters.com,Mexico all but empties migrant shelters under coronavirus,4,1,1587937114
2194,worldnews,IdahoAnalytic,theguardian.com,"Morning mail: truck driver charged, Covidsafe app explained, sexting in lockdown",2,1,1587936862
2195,worldnews,montak22,coronavirusin.world,"Trump Dragged for Newest Anti-Media Rant: Sorry, There Are No ‘Noble’ Prizes for Journalism",0,1,1587936749
2196,worldnews,IdahoAnalytic,independent.co.uk,Coronavirus: New York unveils plan to let some businesses re-open from 15 May,3,1,1587936683
2197,worldnews,RoscoMan1,independent.co.uk,Support for EU membership above 80% in most member states amid Brexit mess,2,1,1587936606
2198,worldnews,IdahoAnalytic,nytimes.com,Spain’s Children Play Outside for First Time Since Lockdown,2,1,1587935369
2199,worldnews,IdahoAnalytic,theguardian.com,Truck driver charged with culpable driving over Melbourne crash that killed four police officers,6,1,1587935048
2200,worldnews,Infjuk,independent.co.uk,"Releasing Bison, Reindeer And Horses Into Arctic 'Would Ease Climate Crisis', Say Scientists.",7,1,1587934721
2201,worldnews,DoremusJessup,france24.com,"Millions of workers traditionally take to the streets for May Day marches, but with half of humanity in lockdown, this is going to be a May 1 like no other",1,1,1587934264
2202,worldnews,IdahoAnalytic,nytimes.com,‘A Perfect Storm’ in Brazil as Troubles Multiply for Bolsonaro,3,1,1587933570
2203,worldnews,IdahoAnalytic,nytimes.com,Boris Johnson Aide Attended Secretive U.K. Coronavirus Panel,6,1,1587933569
2204,worldnews,dethpicable,youtube.com,How a Chinese Casino Conquered a Piece of America,0,1,1587933447
2205,worldnews,hanyhuh,bloomberg.com,Bill Gates’s Coronavirus Vaccine Could Be Ready in 12 Months,7,1,1587933413
2206,worldnews,tbtold373,google.com,BEWARE OF SNAPCHATS VOICE TO TEXT!!! DONT LET THEM TAKE YOUR VOICE!!! #enoughisenough #takecontrolofyourprivacy #movementof2020,2,1,1587933254
2207,worldnews,montak22,coronavirusin.world,Journalism Professors Name on Networks to Cease Airing Trump Briefings Stay,0,1,1587933123
2208,worldnews,IdahoAnalytic,independent.co.uk,"'Don't defend Trump, attack China': Republican memo reveals coronavirus campaign strategy",19,1,1587933068
2209,worldnews,holdupw8,nbcnews.com,Abrams: Trump 'incited' Kemp to reopen Georgia while Pence nodded 'pathetically',0,1,1587932849
2210,worldnews,DoremusJessup,france24.com,"Germany's far-right AfD party on Sunday said it had suspended a longtime spokesman, reportedly after he described himself as a fascist and praised his ""Aryan grandfather""",131,1,1587932735
2211,worldnews,DoremusJessup,france24.com,"Israel's left-wing Labor party, traditionally a staunch opponent of right-wing Prime Minister Benjamin Netanyahu, voted Sunday to join a coalition government he is set to lead",8,1,1587932527
2212,worldnews,Defiant-Month,theguardian.com,Uranium miner coaxed government to water down extinction safeguards - A multinational uranium miner persuaded the federal government to drop a requirement forcing it to show that a mine in outback Western Australia would not make any species extinct before it could go ahead.,0,1,1587932397
2213,worldnews,IdahoAnalytic,theguardian.com,Boris Johnson returns to face critics amid talk of the 'new normal',8,1,1587932355
2214,worldnews,holdupw8,vox.com,Trump claims the media misrepresented his coronavirus cure comments. Video proves otherwise. The president is now routinely lying about things we saw with our own eyes and that are on tape.,5,1,1587932054
2215,worldnews,IdahoAnalytic,nytimes.com,"Comic Insults Aside, Mayors Act as Sentinels in Italy’s Coronavirus Tragedy",3,1,1587931757
2216,worldnews,DirkDeadeye,independent.co.uk,"Kim Jong-un ‘is alive and well’ despite rumours, South Korean presidential aide says",86,1,1587931182
2217,worldnews,Darthcorgibutt,reuters.com,Italy to reopen some businesses as early as this week,4,1,1587930925
2218,worldnews,BobbingForSmegma,vox.com,Italy will take small steps to restart its economy as early as this week,3,1,1587930651
2219,worldnews,hanyhuh,reuters.com,Germany flips to Apple-Google approach on smartphone contact tracing,3,1,1587930276
2220,worldnews,IdahoAnalytic,nytimes.com,Your Monday Briefing,2,1,1587929969
2221,worldnews,Infjuk,news.sky.com,"Coronavirus UK: Over 100,000 Could Die If Only Vulnerable Groups Told To Isolate, Says Professor.",0,1,1587929783
2222,worldnews,ItzEverPena,newsweek.com,Wtf for real,1,1,1587929681
2223,worldnews,montak22,coronavirusin.world,S Africa: Apology issued for ‘blasphemous’ comment in mosque raid,0,1,1587929545
2224,worldnews,montak22,coronavirusin.world,"Exports of Russian wheat dry up, stoking meals safety issues",0,1,1587929544
2225,worldnews,IdahoAnalytic,independent.co.uk,'Hambergers' and 'Noble prizes': Trump attacks press in furious Twitter rant riddled with spelling errors,125,1,1587929471
2226,worldnews,Marcmin,time.com,Spain Lets Children Play Outside for First Time in Weeks as European Nations Ease Restrictions,4,1,1587929240
2227,worldnews,Marcmin,time.com,Turkey Records Decrease in COVID-19 Deaths,0,1,1587929239
2228,worldnews,IdahoAnalytic,thesun.co.uk,Top Russian doctor falls from fifth floor window while on call complaining to bosses about lack of PPE for medics,2552,1,1587928811
2229,worldnews,ibirdceliac,nytimes.com,Coronavirus Antibody Tests: Can You Trust the Results?,11,1,1587928592
2230,worldnews,Upstairs-Implement,youtube.com,OUR FIRST CHRISTMAS! 🎄 | Vlogmas Days 24-25!,0,1,1587927867
2231,worldnews,dontovercommit,edition.cnn.com,"Amid mounting speculation, South Korea says Kim Jong Un is 'alive and well'",1,1,1587927732
2232,worldnews,F888K,theguardian.com,UK vaccine trial volunteer says she is 'doing fine' after online death rumours,8,1,1587927437
2233,worldnews,IdahoAnalytic,thesun.co.uk,Kids allowed out for first time in six weeks in Spain as country’s coronavirus daily death toll drops below 300,5,1,1587927010
2234,worldnews,IdahoAnalytic,thesun.co.uk,El Salvador prisoners crammed together in 24-hour jail lockdown after 22 murders in one day,11,1,1587927009
2235,worldnews,IdahoAnalytic,theguardian.com,Dr Birx downplays Trump’s dangerous coronavirus disinfectant remarks,64,1,1587926962
2236,worldnews,RoscoMan1,japantimes.co.jp,Number of abandoned homes in Japan edges up to record high of nearly 8.5 million,0,1,1587926856
2237,worldnews,WoolfordStudiosLtd,youtube.com,Jalisco Fiasco Daily 26-04-2020,0,1,1587926774
2238,worldnews,__prison__mike__,nationalpost.com,Germany says China sought to encourage positive COVID-19 comments,1,2,1587926567
2239,worldnews,hanyhuh,reuters.com,Close Bolsonaro aide to become Brazil Justice Minister,3,1,1587926200
2240,worldnews,jigsawmap,independent.co.uk,Climate change deniers now downplaying seriousness of coronavirus,225,1,1587926000
2241,worldnews,montak22,coronavirusin.world,‘The Value Is Proper’ Announcer George Grey ‘In Good Spirits’ After three Coronary heart Assaults,0,1,1587925928
2242,worldnews,Upstairs-Implement,youtube.com,Safety First,0,1,1587925928
2243,worldnews,vasilii025,youtube.com,🔴ЭТУ ПЕСНЮ ИЩУТ ВСЕ 2020 🔝 DEEP HOUSE 7 🔝 TOP HITS 2020 музыка онлайн 🎵,2,1,1587925834
2244,worldnews,easyone,theguardian.com,Bolsonaro in fresh crisis over son's alleged links to fake news racket. Claims risk damaging Brazilian president already reeling from resignation of justice minister,20,1,1587925780
2245,worldnews,yellowbrowntwo2,reuters.com,Oklahoma asks Trump to declare coronavirus an 'act of God' to help oil producers,6,1,1587925533
2246,worldnews,hanyhuh,reuters.com,"UK at 'dangerous' stage, no lockdown exit strategy in sight",26,1,1587925354
2247,worldnews,SeleniumF0rest,theguardian.com,Uranium miner coaxed government to water down extinction safeguards - A multinational uranium miner persuaded the federal government to drop a requirement forcing it to show that a mine in outback Western Australia would not make any species extinct before it could go ahead.,0,1,1587925272
2248,worldnews,Rustikitty,france24.com,"A Brazilian bank commercial highlighting the country's diversity was pulled following a request by far-right President Jair Bolsonaro, the bank confirmed",4,1,1587925217
2249,worldnews,RoscoMan1,cnn.com,Interpol: 157 children rescued from West Africa trafficking ring,0,1,1587924936
2250,worldnews,Upstairs-Implement,youtube.com,"Tampa security guard arrested after confrontation in parking garage, fir...",0,1,1587924846
2251,worldnews,Upstairs-Implement,youtube.com,Shooting in Islamic Society of Tampa Bay parking lot during Ramadan even...,0,1,1587924714
2252,worldnews,i__indisCriMiNatE,reuters.com,Vietnamese government forced Facebook to significantly increase censorship of “anti-state” posts,6,1,1587924707
2253,worldnews,Upstairs-Implement,youtube.com,School security officer arrested for sexual battery on elementary studen...,0,1,1587924569
2254,worldnews,Upstairs-Implement,youtube.com,1 dead after shooting at Aqua Lounge in Tampa,0,1,1587924393
2255,worldnews,Sweet_Ocean,reuters.com,Netanyahu confident U.S. will allow West Bank annexation in two months.,25,1,1587924346
2256,worldnews,IdahoAnalytic,theguardian.com,Harry Dunn parents write to UK army chief after 'near misses' near base,3,1,1587924255
2257,worldnews,IdahoAnalytic,theguardian.com,How has the coronavirus transformed Spain?,0,1,1587924254
2258,worldnews,IdahoAnalytic,theguardian.com,"Zali Steggall calls for probe of Coalition plan to underwrite gas, hydro and coal power",1,1,1587924253
2259,worldnews,i__indisCriMiNatE,reuters.com,"Vietnamese Communist government forced Facebook to significantly increase censorship of “anti-state” posts, taking advantage of the pandemic",3,1,1587923736
2260,worldnews,maxwellhill,time.com,Hokkaido Lifted Its Coronavirus Lockdown Too Soon and Became a Warning to the World,987,1,1587923688
