,subreddit,author,domain,title,num_comments,score,timestamp
1399,worldnews,babyggrgg,reuters.com,Ivory Coast presidential candidate Soro sentenced to 20 years in prison,2,0,1588099962
1400,worldnews,RussianBot00961,edition.cnn.com,"75% of Lebanon needs aid after coronavirus: Since a popular uprising gripped the country late in 2019, Lebanon defaulted on its debt for the first time. Now, after nearly two months of lockdown, food prices are soaring and the Lebanese lira is in free-fall",10,2,1588099920
1401,worldnews,BelleAriel,theguardian.com,"British Airways plans to make up to 12,000 staff redundant",3,2,1588099844
1402,worldnews,30ustice4,theguardian.com,Trump is unravelling – even his supporters can't ignore it now,0,1,1588099505
1403,worldnews,Tea-Loving_Linguist,reuters.com,Trump will order U.S. meat processing plants to stay open amid coronavirus fears,20,2,1588099400
1404,worldnews,vaish7848,edition.cnn.com,More than a million cases of coronavirus reported in the US,1,3,1588099290
1405,worldnews,New_Diet,edition.cnn.com,Brazil's supreme court allows investigation of President Bolsonaro,2,3,1588099041
1406,worldnews,montak22,coronavirusin.world,‘The Humorous Dance Present’ Is the Good Really feel-Good Binge Throughout a World Pandemic,0,1,1588098745
1407,worldnews,montak22,coronavirusin.world,Erin Calhoun to Lead Communications for Showtime Networks,0,1,1588098745
1408,worldnews,montak22,coronavirusin.world,US struggles to reopen as coronavirus circumstances hit 1 million mark,0,1,1588098744
1409,worldnews,montak22,coronavirusin.world,‘Labor of Love’: Right here Are All 15 Contestants Competing to Develop into Dads (Photographs),0,1,1588098743
1410,worldnews,seanspeaks77,youtube.com,"How To Cure Cancer, Coronavirus and 99.99% of Most Our Health Problems Worldwide",0,1,1588098139
1411,worldnews,terimoath,theguardian.com,Pentagon releases three UFO videos taken by US navy pilots | World news,8,3,1588098000
1412,worldnews,[deleted],reuters.com,"British Airways warns as many as 12,000 jobs to go",0,2,1588097909
1413,worldnews,WoolfordStudiosLtd,youtube.com,Jalisco Fiasco Daily 28-04-2020,0,1,1588097296
1414,worldnews,How_art_thou_fallen_,bloomberg.com,Trump to Order U.S. Meat Plants to Stay Open Amid Pandemic,21,7,1588097167
1415,worldnews,maxwellhill,bbc.co.uk,"A coronavirus-themed game has been blocked on Steam in China because of its politically motivated content: In order to win Coronavirus Attack, players have to stop ""selfish zombies"" from escaping a country infected with the virus.",532,7,1588096920
1416,worldnews,Upstairs-Implement,youtube.com,"First Lieutenant, US Army | My budget &amp; planning for the future | Part 3...",0,1,1588096903
1417,worldnews,SeleniumF0rest,theguardian.com,New Zealand prisons spent $1m on slushie machines to cool tensions - Corrections department feared another summer heatwave could lead to a rise in violent incidents,0,1,1588096729
1418,worldnews,maxwellhill,bbc.co.uk,"Former school inspector rates own home schooling 'atrocious': His ""pupils"" had been found playing Fortnite by way of a geography lesson. The post resonated with parents, as millions struggle to home school their children amid the coronavirus epidemic.",117,7,1588096503
1419,worldnews,speakhyroglyphically,metro.co.uk,"'All wars must stop' to fight coronavirus as pandemic speeds up across the globe [Mar 23,2020]",17,0,1588096337
1420,worldnews,MystikSpiralx,bloomberg.com,"Virus Likely to Keep Coming Back Each Year, Say Top Chinese Scientists",10,0,1588096308
1421,worldnews,Thom_the_chef,youtube.com,No Lockdown In Stockholm- Sweden's response to Covid-19,0,1,1588096196
1422,worldnews,Fuzier,theguardian.com,Prague mayor under police protection amid reports of Russian plot: Zdenêk Hřib says there is ‘risk to my life’ as magazine alleges he was poisoning target,0,2,1588096179
1423,worldnews,chrisdh79,cnn.com,Sweden says its coronavirus approach has worked. The numbers suggest a different story,33,4,1588096153
1424,worldnews,altbekannt,uk.reuters.com,Germany's Merkel wants green recovery from coronavirus crisis,7,6,1588096042
1425,worldnews,TechTavi,theguardian.com,UN chief: don't use taxpayer money to save polluting industries,18,7,1588095308
1426,worldnews,IntnsRed,reuters.com,"China discounts, cheaper iPhone to cushion Apple from virus blow to demand",6,2,1588095241
1427,worldnews,montak22,coronavirusin.world,Chip and Joanna Gaines’ Magnolia Community Sneak Peek Demolishes DIY Rankings Information,0,1,1588095134
1428,worldnews,montak22,coronavirusin.world,Neon Promotes Elissa Federoff and Christina Zisa to President Roles,0,1,1588095133
1429,worldnews,montak22,coronavirusin.world,"US legislators abruptly cancel plans to return to Washington, DC",0,1,1588095132
1430,worldnews,montak22,coronavirusin.world,Chip and Joanna Gaines’ Magnolia Community Sneak Peek Demolishes DIY Scores Data,0,1,1588095131
1431,worldnews,montak22,coronavirusin.world,Why Your Favourite Dangerous Present In all probability Gained’t Be Canceled This Yr – Even by Low TV Rankings,0,1,1588095130
1432,worldnews,montak22,coronavirusin.world,Tens of millions of People nonetheless cannot entry jobless advantages: survey,0,1,1588095129
1433,worldnews,montak22,coronavirusin.world,It may worsen for the oil market after the WTI collapse,0,1,1588095128
1434,worldnews,montak22,coronavirusin.world,Coronavirus outbreak in Syria’s Idlib a ‘matter of time’,0,1,1588095128
1435,worldnews,montak22,coronavirusin.world,WFP warns meals insecurity might greater than double in East Africa,0,1,1588095127
1436,worldnews,Demonslayer2011,washingtonpost.com,A hot take from everyone's favorite monarch of Jordan.,0,1,1588095101
1437,worldnews,manjaro_fan,reuters.com,"After deal with Boeing went south, Mourao (Brazil's vice-president) said of China. “This shows once again that a marriage (with China) needs to continue, because it is an inevitable marriage.”",23,6,1588094968
1438,worldnews,Sheeraz_raza,nytimes.com,Hillary Clinton to Endorse Joe Biden,42,4,1588094830
1439,worldnews,SatanGuru,newsweek.com,India Clashes With China After Returning Order Of Half A Million 'Faulty' Coronavirus Antibody Test Kits,91,6,1588094798
1440,worldnews,Exastiken,uk.reuters.com,UK on track for one of Europe's worst virus death tolls,1,4,1588094626
1441,worldnews,[deleted],reuters.com,UK on track for one of Europe's worst virus death tolls,0,2,1588094573
1442,worldnews,DoremusJessup,france24.com,Lebanese protesters angered by a spiraling economic crisis clashed with security forces in the country's north overnight as a months-old anti government movement gained new momentum despite a coronavirus lockdown,4,3,1588094433
1443,worldnews,Lolastic_,uk.reuters.com,U.S. senator urges criminal probe of Amazon.com 'predatory data practices',3,9,1588094302
1444,worldnews,Marcmin,time.com,Refugee Boats Stranded at Sea Show How COVID-19 Is Making Threatened Groups More Vulnerable,0,3,1588094043
1445,worldnews,Exastiken,reuters.com,Germany's Merkel wants green recovery from coronavirus crisis,4,7,1588093477
1446,worldnews,Exastiken,reuters.com,Stripping naked for masks: German doctors protest lack of protective gear,6,1,1588093439
1447,worldnews,hildebrand_rarity,theguardian.com,Spanish official apologises for spraying beach with bleach,7,4,1588093360
1448,worldnews,anarchytravel,bbc.co.uk,"British Airways to cut up to 12,000 jobs",17,4,1588093152
1449,worldnews,SacoolloocaS,theguardian.com,"Record 50 million people internally displaced in 2019, study finds",2,2,1588092467
1450,worldnews,telanganaawam,youtube.com,TELANGANA AWAM KHABARNAMA,2,1,1588091720
1451,worldnews,montak22,coronavirusin.world,"Argentina’s coronavirus sufferers, medical employees harassed",0,1,1588091544
1452,worldnews,montak22,coronavirusin.world,‘This American Life’ Episodes Lastly Come to Spotify,0,1,1588091543
1453,worldnews,montak22,coronavirusin.world,Tokyo Olympics President: Video games Could be Canceled Slightly Than Pushed to 2022 if Virus Nonetheless a Menace,0,1,1588091543
1454,worldnews,montak22,coronavirusin.world,Rankings: ‘Prodigal Son’ Season Finale Is Good Sufficient for Fox to Cling Onto Monday Win,0,1,1588091542
1455,worldnews,theme9m,foxnews.com,"Coronavirus tribute: Air Force Thunderbirds, Navy Blue Angels to fly over northeastern US",0,1,1588091358
1456,worldnews,GOR098,bbc.co.uk,Coronavirus: 'One billion' could become infected worldwide - report,19,7,1588091102
1457,worldnews,SiberianPermaFrost_,washingtonpost.com,CDC confirms six coronavirus symptoms showing up in patients over and over,14,5,1588090960
1458,worldnews,Marcmin,time.com,UN Chief Says ‘Collaborative Leadership’ Is Critical to Fight Both Coronavirus and Climate Change,4,3,1588090443
1459,worldnews,Tendofreak,bbc.co.uk,"Update on Captain Tom, British WW2 Veteran who has now raised more than £29 million so far for the British National Health Service. Be proud of your elders, and be grateful you still have the freedoms they fought so hard for us to keep. The fight continues...",1,3,1588090425
1460,worldnews,[deleted],google.com,Pentagon releases UFO videos for the record,0,1,1588090418
1461,worldnews,meekaa_saangoo,bbc.co.uk,Pentagon releases UFO videos for the record,17,3,1588090402
1462,worldnews,llllIlIlllll,cnn.com,A young boy was killed by a police stray bullet during a coronavirus curfew. Now his parents want answers,0,1,1588090276
1463,worldnews,WoolfordStudiosLtd,youtube.com,LHG Daily 28-04-2020,0,1,1588090102
1464,worldnews,ImpulseControl,newsweek.com,The controversial experiments and Wuhan lab suspected of starting the coronavirus pandemic,23,7,1588089527
1465,worldnews,Rockytriton,washingtonexaminer.com,US must stand with Australia against China's economic threats,0,1,1588089447
1466,worldnews,Rockytriton,washingtonexaminer.com,US must stand with Australia against China's economic threats,0,1,1588089418
1467,worldnews,howtochangemywife,bbc.co.uk,"Disclosure: Rape victims among those to be asked to hand phones to police. Victims of crimes, including those alleging rape, are to be asked to hand their phones over to police - or risk prosecutions not going ahead.",0,1,1588089399
1468,worldnews,ezmuffin,theguardian.com,Amazon and other platforms allowing payments to far-right groups,9,1,1588088724
1469,worldnews,Marcmin,time.com,"Rare Illness in Children May Be Related to Coronavirus, European Doctors Are Warned",0,8,1588088656
1470,worldnews,12466350,independent.co.uk,"Pandemics will become worse and more frequent unless we stop exploiting Earth and animals, top scientists warn",2330,12,1588088625
1471,worldnews,ezmuffin,theguardian.com,Climate experts call for 'dangerous' Michael Moore film to be taken down,28,3,1588088593
1472,worldnews,f4gc9bx8,nytimes.com,U.S. May Share Less Intelligence With Countries That Criminalize Homosexuality,7,5,1588088256
1473,worldnews,Plus-Staff,edition.cnn.com,US oil drops as much as 20% as oversupply concerns keep roiling markets,0,3,1588087992
1474,worldnews,montak22,coronavirusin.world,ABC Information Reporter Responds After Being Seen With out Pants on Air: ‘Hilariously Mortifying’,0,1,1588087946
1475,worldnews,montak22,coronavirusin.world,RuneScape Developer Jagex Acquired for $530 Million,0,1,1588087945
1476,worldnews,montak22,coronavirusin.world,Dr. Fauci Says Brad Pitt Did a ‘Nice Job’ Portraying Him on ‘SNL’,0,1,1588087945
1477,worldnews,montak22,coronavirusin.world,Dave Grohl Surprises New York ER Nurse With a Particular Zoom Serenade (Video),0,1,1588087944
1478,worldnews,montak22,coronavirusin.world,US shares rally on hopes for extra lockdown easings,0,1,1588087943
1479,worldnews,montak22,coronavirusin.world,Hulu Outages Spark #HuluDown Hashtag on Twitter,0,1,1588087941
1480,worldnews,montak22,coronavirusin.world,Dr. Fauci Says Brad Pitt Did a ‘Nice Job’ Portraying Him on ‘SNL’,0,1,1588087941
1481,worldnews,montak22,coronavirusin.world,UK coronavirus dying toll under-reported by 52 p.c,0,1,1588087940
1482,worldnews,ploflo,reuters.com,Driver who rammed Paris police pledged allegiance to Islamic State,2,7,1588087609
1483,worldnews,ballsonmystrudel,youtube.com,"May 8, 2019 - China tries to thwart CNN investigation into detention camps",1,1,1588087443
1484,worldnews,mitchanium,bbc.co.uk,Two brothers with coronavirus die on same day,5,2,1588087043
1485,worldnews,Zhana-Aul,newsweek.com,"Russian soccer player to be ""punished"" for criticizing Vladimir Putin's coronavirus response",116,8,1588086832
1486,worldnews,Ra75b,reuters.com,Ivory Coast presidential candidate Soro sentenced to 20 years in prison,1,4,1588086278
1487,worldnews,dirtyviking1337,thesun.co.uk,Five beheaded victims were gay lovers 'tortured into terror confessions',1,1,1588086217
1488,worldnews,vahvachanneltelugu,youtube.com,ఈజీగా వీడియో ఎడిటింగ్ చేయడం ఎలా? vahva channel,1,1,1588086127
1489,worldnews,Claspedtangent04,independent.co.uk,Bill De Blasio caught violating Stay At Home order,6,5,1588086109
1490,worldnews,randy88moss,cnn.com,The President of El Salvador has authorized lethal force by police and military against gangs after a deadly weekend,61,9,1588086088
1491,worldnews,toddthetiger,bbc.co.uk,"BBC criticises US Protesters for not wearing masks, while recommending strongly against wearing masks.",16,1,1588086004
1492,worldnews,D2theCCNP,time.com,Four Trans People Murdered in Puerto Rico in Past Two Months,7,3,1588085784
1493,worldnews,dcismia,reuters.com,"Russia sees record rise in coronavirus cases, deaths",7,9,1588085409
1494,worldnews,Marcmin,time.com,"Pandemic Causing Shortage of Contraceptives and Will Impact Women’s Reproductive Health, Says U.N.",10,7,1588085064
1495,worldnews,Marcmin,time.com,Beloved Naples Pizzerias Reopen for Delivery After Two Month Lockdown,5,5,1588085063
1496,worldnews,TallFee0,youtube.com,Coronavirus spreads within the Saudi royal family,0,1,1588085034
1497,worldnews,Axari9,youtube.com,Italian Boy Create coronavirus video game in Lockdown | Quarantine | COV...,0,1,1588085028
1498,worldnews,dcismia,reuters.com,Venezuela appoints alleged drug trafficker El Aissami as oil minister,51,11,1588084707
1499,worldnews,momentum77,washingtonpost.com,Britain’s national health authority has just issued an alarming alert about children and covid-19 - The Washington Post,4,7,1588084570
1500,worldnews,SaulKD,nytimes.com,Coronavirus Diplomacy: How China’s Red Cross Serves the Communist Party,3,6,1588084462
1501,worldnews,montak22,coronavirusin.world,Alex Trebek Praises ‘Jeopardy’ Contestant for Doing ‘One thing That By no means Occurs’ on ‘Jeopardy’ (Video),0,1,1588084353
1502,worldnews,montak22,coronavirusin.world,NY Occasions Rejects Sean Hannity’s Authorized Menace: ‘No Foundation’ for Retraction or Apology,0,1,1588084352
1503,worldnews,montak22,coronavirusin.world,Jimmy Fallon Wrote the Quarantine Anthem We’re All Feeling by Now: Right here’s ‘Beginning to Crack’ (Video),0,1,1588084351
1504,worldnews,montak22,coronavirusin.world,Jimmy Fallon Wrote the Quarantine Anthem We’re All Feeling by Now: Right here’s ‘Beginning to Crack’ (Video),0,1,1588084350
1505,worldnews,montak22,coronavirusin.world,MSNBC’s Joe Scarborough Says Trump Was ‘Oblivious’ to Coronavirus Menace in January,0,1,1588084349
1506,worldnews,PBR--Streetgang,vox.com,The successful Asian coronavirus-fighting strategy America refuses to embrace,6,4,1588083765
1507,worldnews,geoxol,nbcnews.com,Face masks for passengers now required on all JetBlue flights,1,6,1588083445
1508,worldnews,Marcmin,time.com,Healthcare Workers From Refugee Backgrounds Want to Help Fight COVID-19. One Man’s Journey Shows How That Might Be Possible,0,0,1588083267
1509,worldnews,poleco1,in.reuters.com,Japan would 'scrap' Olympic Games if not held next year - Tokyo 2020's Mori,3,9,1588083137
1510,worldnews,WoolfordStudiosLtd,youtube.com,SwipeStrike Daily 28-04-2020,0,1,1588082901
1511,worldnews,RaphaelCarpenter,edition.cnn.com,Pentagon officially releases UFO videos,12,6,1588082704
1512,worldnews,videonosound,twitter.com,"WATCH: QC gov’t personnel seen beating man for alleged quarantine violation. QC City Hall has condemned act, says now investigating incident. (WARNING: Graphic video)",0,1,1588082612
1513,worldnews,FenrirIII,theguardian.com,Britain holds minute's silence in tribute to coronavirus dead | World news,3,7,1588082593
1514,worldnews,maxwellhill,edition.cnn.com,"Germans face fines of up to $5,000 as wearing a face mask becomes mandatory",30,5,1588082519
1515,worldnews,miho81,youtube.com,Rammstein - Ohne Dich (Live München 09.06.2019),1,1,1588082402
1516,worldnews,VoiceOfAntonio,youtube.com,Check out my youtube channel and subscribe for a chance to win 100$ cash!,1,1,1588082341
1517,worldnews,Oityouthere,uk.reuters.com,UK on track to become one of Europe's worst hit in COVID-19 pandemic,2,5,1588082337
1518,worldnews,Zhana-Aul,theguardian.com,Spanish official apologises for spraying beach with bleach,9,5,1588082222
1519,worldnews,ThatsMySpatula,uk.reuters.com,"Coronavirus cases in India climb towards 30,000; Pakistan mosques a growing worry",5,4,1588082172
1520,worldnews,roku44,newsweek.com,Trump Says U.S. Is Seeking Compensation From China Over COVID-19,373,1,1588081870
1521,worldnews,roku44,newsweek.com,"As Germany Eases Lockdown Restrictions, Coronavirus Infection Rate Rises",4,1,1588081659
1522,worldnews,[deleted],metro.co.uk,"Member of grooming gang jailed for four years for raping girl, 13",1,1,1588081515
1523,worldnews,Marcmin,time.com,"New Zealand Reopens Beaches, Cafes as New Coronavirus Cases Drop",1,1,1588081465
1524,worldnews,hildebrand_rarity,theguardian.com,Norwegian tycoon arrested over wife's disappearance in 2018,1,1,1588081373
1525,worldnews,hildebrand_rarity,newsweek.com,Biggest Asteroid of the Year to Whiz Past Earth Tomorrow—and It Looks Like It's Wearing a 'Face Mask',12,1,1588080994
1526,worldnews,Admiral_Asado,reuters.com,"Lesbians, gays live in fear of attacks in Kenyan refugee camp",13,1,1588080762
1527,worldnews,montak22,coronavirusin.world,"‘Trolls World Tour’ Earns Almost $100 Million in First three Weeks of VOD Leases, Common Says",0,1,1588080730
1528,worldnews,montak22,coronavirusin.world,Japanese European care staff in Italy thrust into uncertainty,0,1,1588080729
1529,worldnews,nimobo,reuters.com,"Canadian oil sands hub floods, some residents evacuate amid virus fight",5,1,1588080609
1530,worldnews,1wakeupcall,youtube.com,DR RASHID BUTTAR EXPOSES VIRUS AGENDA,0,1,1588080513
1531,worldnews,allbanglatips,youtube.com,হযরত মোহাম্মদ সাঃ এর ছেলে ও মেয়ে কতজন ছিল? নাম কি? (Prophet Muhammad Children),0,1,1588080307
1532,worldnews,SnipedYou,bloomberg.com,China to Help Build $3 Billion Coal Plant in Zimbabwe,9,1,1588080146
1533,worldnews,discocrisco,nbcnews.com,German doctors protest lack of protective equipment by posing naked,10,1,1588079907
1534,worldnews,zmunky,google.com,Organizer of North Carolina group protesting quarantine rules sidelined with coronavirus,0,1,1588079863
1535,worldnews,6800s,cnn.com,Pentagon officially releases UFO videos,6,1,1588079836
1536,worldnews,discocrisco,reuters.com,EU sees new Brexit talks 'at an impasse': sources,26,1,1588079694
1537,worldnews,Ethiw_Freeman,youtube.com,How may US shale respond to the latest crisis?,2,1,1588079688
1538,worldnews,pcaversaccio,edition.cnn.com,Sweden says its coronavirus approach has worked. The numbers suggest a different story.,5,1,1588079414
1539,worldnews,sunflowerhs,in.reuters.com,"U.S. coronavirus cases approach 1 million, one-third of global infections: Reuters tally",15,1,1588079327
1540,worldnews,GroundbreakingSale1,youtube.com,FORMATTING TAGS - HTML,0,1,1588078754
1541,worldnews,emily_9511,nbcnews.com,"Tyson Foods plants forced to shutter across the US, chairman warns “The food supply chain is breaking.”",21,1,1588078670
1542,worldnews,pnewell,theguardian.com,Meteorologists say 2020 on course to be hottest year since records began,9,1,1588078649
1543,worldnews,Upstairs-Implement,youtube.com,PROMOTION PROCESS FOR AIR FORCE JUNIOR OFFICERS!,0,1,1588078480
1544,worldnews,Monteoas,uk.reuters.com,"Russia sees record rise in coronavirus cases, deaths; The number of new coronavirus cases in Russia rose by 6,411 on Tuesday, bringing its nationwide tally to 93,558. The number of deaths rose by 72, also a daily record, taking the total number of fatalities to 867",13,1,1588078048
1545,worldnews,Frocharocha,theguardian.com,Brazil President Jair Bolsonaro faces inquiry into claims of illegally attempting to interfere in the federal police.,5,1,1588078019
1546,worldnews,red_carpet_magic,newsweek.com,PENTAGON JUST RELEASED UFO FOOTAGE THANKS IN PART TO TOM DELONGE,0,1,1588077963
1547,worldnews,chrisdh79,independent.co.uk,US admits killing civilians in Somalia airstrike,14,1,1588077714
1548,worldnews,Netship01,bloomberg.com,South Korean Ministers Say They Know Kim Jong Un’s Location,7,1,1588077620
1549,worldnews,Frocharocha,theguardian.com,A judge from Brazilian federal government gave 48 hours to Bolsonaro to hand over the results of two Covid-19 tests by the taken by the president last month but refused to be published.,0,1,1588077557
1550,worldnews,montak22,coronavirusin.world,"Ms. Minnie, Star of ‘Little Girls: Atlanta,’ Dies at 34",0,1,1588077132
1551,worldnews,montak22,coronavirusin.world,‘Purchase a masks or meals?’: South Asia’s poor face stark alternative,0,1,1588077132
1552,worldnews,montak22,coronavirusin.world,French fishing trade: Combating to outlive lockdown,0,1,1588077131
1553,worldnews,montak22,coronavirusin.world,UK kids dying of recent illness ‘presumably linked to coronavirus’,0,1,1588077130
1554,worldnews,azatoth12,theguardian.com,China's state media editor Hu Xijin mocks Australia 'gum stuck to China's shoe' in coronavirus investigation stoush,14,1,1588076890
1555,worldnews,ManiaforBeatles,theguardian.com,"UK MPs to try to ban 'rough sex' murder defence in domestic abuse bill - MPs are to try to outlaw the courtroom murder defence of “rough sex gone wrong” during parliamentary debates on the domestic abuse bill, as cases of domestic violence soar during the coronavirus lockdown.",33,1,1588075883
1556,worldnews,Upstairs-Implement,youtube.com,STUCK IN MONTANA?!,0,1,1588075800
1557,worldnews,Molire,reuters.com,"Russia sees record rise in coronavirus cases, deaths — Russia saw a record daily rise in new coronavirus cases and related deaths on Tuesday, its coronavirus crisis response centre said, with data suggesting world’s biggest country by territory has overtaken China and Iran in confirmed infections.",4,1,1588075765
1558,worldnews,anon99129,washingtonpost.com,Trump’s daily intelligence briefing warned of COVID-19 threat more than 12 times in January and February - briefings he routinely skips,39,1,1588075720
1559,worldnews,WoolfordStudiosLtd,youtube.com,Head Home Daily 28-04-2020,0,1,1588075701
1560,worldnews,ManiaforBeatles,theguardian.com,"Lithuania’s capital, Vilnius, has announced plans to turn the city into a vast open-air cafe by giving over much of its public space to hard-hit bar and restaurant owners so they can put their tables outdoors and still observe physical distancing rules.",940,1,1588075433
1561,worldnews,Defiant-Month,theguardian.com,Marine experts in Norway believe they have stumbled upon a white whale that was trained by the Russian navy as part of a programme to use underwater mammals as a special ops force.,0,1,1588075349
1562,worldnews,ISayISayISay,theguardian.com,China starts major trial of state-run digital currency,5,1,1588075115
1563,worldnews,Upstairs-Implement,youtube.com,Afghanistan screens passengers for virus,0,1,1588075084
1564,worldnews,MrXam,google.com,Indian Government Red Flags Zoom Video Conferencing App,0,1,1588075048
1565,worldnews,M3taGam3,reuters.com,EU sets out 'quick fixes' to boost bank lending during pandemic,1,1,1588074974
1566,worldnews,MilitaryMonitor,news.sky.com,Trump: I'm not responsible for people misusing disinfectant | US News,2,1,1588074893
1567,worldnews,Upstairs-Implement,youtube.com,DFN:Afghanistan: Mobile Train/Advise/Assist Team from the NATO-led Resol...,0,1,1588074526
1568,worldnews,Defiant-Month,theguardian.com,Marine experts in Norway believe they have stumbled upon a white whale that was trained by the Russian navy as part of a programme to use underwater mammals as a special ops force.,0,1,1588074360
1569,worldnews,jayantadey1996,youtube.com,World Religions Population Statistics (1900-2050),2,1,1588074249
1570,worldnews,dirtyviking1337,theguardian.com,Marine experts in Norway believe they have stumbled upon a white whale that was trained by the Russian navy as part of a programme to use underwater mammals as a special ops force.,0,1,1588074141
1571,worldnews,dirtyviking1337,theguardian.com,New Zealand prisons spent $1m on slushie machines to cool tensions - Corrections department feared another summer heatwave could lead to a rise in violent incidents,0,1,1588074012
1572,worldnews,Upstairs-Implement,youtube.com,Afghanistan Store Owners Use Mobile Hand Washing Stations to Fight Coron...,0,1,1588073990
1573,worldnews,rick9674,in.reuters.com,South Korea says North Korea's absent Kim may be trying to avoid coronavirus,0,1,1588073895
1574,worldnews,rick9674,newsweek.com,"China suggests U.S. is ""hiding something"" about its coronavirus response, demands an answer from Trump administration",146,1,1588073717
1575,worldnews,montak22,coronavirusin.world,Pakistan registers its deadliest day of coronavirus pandemic,0,1,1588073543
1576,worldnews,montak22,coronavirusin.world,Physician’s Observe: Why can we get fevers?,0,1,1588073542
1577,worldnews,iSleepUpsideDown,theguardian.com,Australian doctors on alert after Kawasaki disease in children linked to Covid-19,3,1,1588073431
